title,text,link,pub_date,source,search_query,stage2_reason,credibility_tier,credibility_score
Dabur India signs deal to acquire minorty stake in RAS Beauty,Dabur India signs deal to acquire minorty stake in RAS Beauty,https://news.google.com/rss/articles/CBMi2wFBVV95cUxNaXNuZnE1djh4dWpTcUc5aVpTRTlVbXBtLTY4UzlsTTNLRXpWNHc2WjFRRUdLOTNXbjJPV3JlOEpxdzFLd2dINUE0X3Z5aDNmb0k5VUhVOFFxSDZsMk1xVF9GY1l3MGlhT1J0aEp3XzlpRnNVaE9xLWdVYTExc0ljMjczcTEyTGRaVG1tcFVYWHBjTUNreUt6NGNWNGdaZHo0NkZfZjdTSDMxMnlHaVdYR1ZpMmdLLS1xUERRY2N5ZmpIWWxoNDQ2SVdiUmNyTU5uWk9CVzJYYTF0akXSAeABQVVfeXFMT1laV2FwZjQ4cGZFMHV4QkFya2xTZ1VCRFE2ZVZJbmRDbXBwTWJQSVBRWG9vUjg1emtoZ2h4WEFBYjR1djY5Tm5VR2I3eElLZVJYNXBWRVV0bU5KQkV0RzBBVzFWMzR3OUtUeGF5YjZlZ3FoU1ZiSGdDRVRkRE1qODZ1amRZWnZidXpZSUpUeEF0dVZHRnFOX0RpX1ZZYnNUZW82S1BtTmVjdkxvZU5UcFJKNWdySDVDLUttQjBHNGFXcEJZdGJaMHJMVXh5bTNIZ2JTZlVySTB5Q1lRczlkbWc?oc=5,"Wed, 04 Mar 2026 08:00:00 GMT",Business Standard,Dabur acquisition stake,passed: named FMCG company + deal verb present (exclusion check bypassed - trusted acquirer identity),tier_1,1.0
Dabur India acquires entire stake in Asian Consumer Care from JV partner,Dabur India acquires entire stake in Asian Consumer Care from JV partner,https://news.google.com/rss/articles/CBMi3AFBVV95cUxPLTN1RjNNbkhYdTZCQzJPNWR4cFJUUkNHTnVpa3U4RGNLNlhTdmd2WHFFdnJwcGNqZkRuNDlSUGtYd0R5MkRUcG4wSVNwYTdlcG95cnk5T1lfZmw2a0FmcHhJMndTQnFVMEpKek1Tb056MEptUks1cDBacUVtdE5PWmtFaHc5S2duaTh4alRZd2k5d3dGRE9XN3NLUjJ1T2FlVUJqeHVpRDRuNElremFiUFdNWTU0SHVCNlJnamh6MzQzeVZ6QXdlYUNYX1p3TUtfVU1yemppX3JNTUxh0gHiAUFVX3lxTFBlcERuX1Q5ZlhpbHE5elVOODdldHdzZTFHS25SQnJFZWtkOWRkVldqQzhRMTB0OXhSLUppU0ZaMjdRS3psUEhabVZpUzN6UURGak9PcWpnSXJqazdQMlh5TlZIS2ppT00zRHV3eDlRNjFVbkRjLWlpVWk1SVU3NUhQNXEwMERqMENaYUlmeWduWVJzbUt2aWx4OTJ3MlhsVEt3blFiam9ULXRFSEtkT1A4UmpSZUswbXlGVmt0QW5JS2ItY2J2dFF4UzBnLUdDYnh4YkRhSkwzMU9qa1VMSjZZcXc?oc=5,"Wed, 13 Jul 2022 07:00:00 GMT",Business Standard,Dabur acquisition stake,passed: named FMCG company + deal verb present (exclusion check bypassed - trusted acquirer identity),tier_1,1.0
Dabur expands haircare portfolio with Sesa Care acquisition,Dabur expands haircare portfolio with Sesa Care acquisition,https://news.google.com/rss/articles/CBMizgFBVV95cUxQeGw3d1R1MWpnN3d3OW1TejBYcGNqTVJHbHdkV1hzYkJ1X1VwX19NWHZESWN0SWYzeGpvcDJqQk5fTEZjUDBTZkJ2M2Y4T3BsQ3FIdGdpUFBqSzdlbm9UemI0MlZfU0lLNUh6c2l2WWkyQzhuZFBXMzFfWWF3QjQxUm9ESmxGelUyTlFqb2NubkpacFFtbnlzQXN5UzNIS0dVdXdkX0hfYi1Pd3dpeFNFY0w0dFdQZHlFU19HZWVDZFdNdmxidlY0dlVaejJNd9IB0wFBVV95cUxNV002M0hlNUN4TENua2JaSDdtenFmaVlCQjZsS0tSVHZMdGNCOHZHcE4ybUo2S3pMVU5Cdl9McmRvYWVTQzZaY3RvdS0tYWNJR09va3Q3eU91c0tWRFZLdnBHc0JfZnZ2TnR5VkNjZ2d3YXdKTGk4UXhBS3EteDkyNVpRTGx2ek1oMlBXblpaSEVNRWxWQldPaWZtOHpDU1ZLeTB1Y1lNeWxpOUFCWHNEcmRnYWdwVFlGYmloR09tbjA4SFVXSFF0dTUwaGJNQUJ2RHZ3?oc=5,"Wed, 30 Oct 2024 07:00:00 GMT",livemint.com,Dabur acquisition stake,passed: named FMCG company + deal verb present (exclusion check bypassed - trusted acquirer identity),tier_1,1.0
"Dabur's Burman family increases stake in Eveready Industries, buys 8.48%","Dabur's Burman family increases stake in Eveready Industries, buys 8.48%",https://news.google.com/rss/articles/CBMiygFBVV95cUxNcl83MnhFYV9ZMHNIdzRISnMyLUtVejJFSDV0b0llTnNHWlJDRWI2YkJGdjRwdDQ1Mk80VDNENmlXNktkLWJ3bWZDWTZ2d3RQSFFKUFlYUXduVEVTYlRVQ1hfaERUTjNTZzhTMnJHUGJfOEJ2UWpHWGRDcE1sdUhVNkZNZzZMbUFpR3JYRXNUWUt0dDZHR0VsMlpXVXRQcndsb0VEME56VnpvWWNaUXNtRmVTRTRDTVhjaC10NkRNa1JqUXpaVmozcEFR0gHPAUFVX3lxTE45ZTRBZUtIcV83M1czeUhXTDExQ3hXZVlEYVg3eEgwdlRtUjMybDdfQ0JtRk4wRXRNa1FuOWRJZWNTSlAzVUhCOGlzR2pPWkMxdXJUM1ZjUlNGeTJCYzc0cXROQmcxX0s1TTVObGhlaU9IV2Y3aWlNS21ZVXlsQVFkcjVjdWpqYWtxenpCbm9CTWxzUk5TZUJFRmhiczdkbHR2d1pIazNVM0JYNmM1dFNTVDg3STdaY1drQ1JmSzhxWHhyd1F1Q01tcFBUdGVIcw?oc=5,"Tue, 14 Jul 2020 07:00:00 GMT",livemint.com,Dabur acquisition stake,passed: named FMCG company + deal verb present (exclusion check bypassed - trusted acquirer identity),tier_1,1.0
Dabur acquires majority stake in Fem Care Pharma for Rs 204 cr,Dabur acquires majority stake in Fem Care Pharma for Rs 204 cr,https://news.google.com/rss/articles/CBMi_gFBVV95cUxOV2V6b0l3UWhKcHp1dWNWZ0xsU3dia1piakhZRHkyRWVfSWFsTnRkWU1LVEN5TVhpODZOSndFNE5JRm9MWHFobGRWM1FBQ3VnQmhTSGgwNDM0TzNTbmY4bzJfQ3JlT1ljVWFoTm9tWUFqN3VEbUt3anNycXFnQTdLOUM4MXl2ajUwZERSZ2NVNXFWRzZrS1FnQlFBRDRKSVhmWUtNbmJnN0N4ZlV6UERZNmxxUC1oRHQwei0xMUYwVGczUG1BTUpuX3JlMTR1Z2FqckN0WWI0Vk1HeER6ZWxEWklpVVFMTXBLS0RrRXhIZEtkUGZuWWg5WTg3ZGtMZw?oc=5,"Fri, 21 Nov 2008 08:00:00 GMT",The Economic Times,Dabur acquisition stake,passed: named FMCG company + deal verb present (exclusion check bypassed - trusted acquirer identity),tier_1,1.0
"Marico's acquired brands generate ₹1,552 crore in FY26","Marico's acquired brands generate ₹1,552 crore in FY26",https://news.google.com/rss/articles/CBMivAFBVV95cUxNZlJwQjM0ejZUTGxlY256MENOakxqVnJSVzBvc3djbGEwRkhVbElHVTZvVmlJN185bWV2bUp4OUllTGc4TTMxRTI1ODQ3LUkyazN3NVBkYndueUppMEJ6RFNsaEFUNHluTVpoQzJYV1gtNFpmSUM1RjZIYmI0MmJkZEg3RjM4X0MxUVF3MDlaZkJRXzNyTzE1VDRvNE5rWXFTczdkQ3VtLUY3dnp0dFhWMF9rQ245Nk1ublJGa9IBwgFBVV95cUxNZFdJMWZpYXNjeFhacXQtN19oTlJqS25PQzZ5Qjl2V0JKMHFwek54dWROSFdoQVFhbFVaeU01VkI4RE94WFZTNGxHZFNWakI3UlFncmFfeFc2MXY0YzI1TU9YM3Z0MzY0V3JmMGpNQk5QeUZMaEZQZW4xOFg1YUo4aURMcnBpMjcxdWxJTDJIUHVKWTZpNzY4cXFXaGh3NEI0azZpcjl0VjVJVC0wa3NFYmNicEw4N0tkRmNiUjc2d2VPUQ?oc=5,"Thu, 09 Jul 2026 14:03:54 GMT",livemint.com,Marico acquisition investment,passed: named FMCG company + deal verb present (exclusion check bypassed - trusted acquirer identity),tier_1,1.0
Marico to acquire 60% stake in Cosmix Wellness for nearly ₹226 crore — What investors should know,Marico to acquire 60% stake in Cosmix Wellness for nearly ₹226 crore — What investors should know,https://news.google.com/rss/articles/CBMi-gFBVV95cUxQWXNaRFFfNWo5Y2xoUkY3U0hQS3lPaXJORUtYQ2IteDFyYkJwcjE1bmVfVGJXOXFhZF9wN3h2TkNTUVYtVl9RZy03OFMwWlVfTm54X3ZJTkZwTGM5T3p2ejJpOUNIQlBrZ1NYMEROYXNLRTlZUHhmSU9naTFmMjZDT1l0aTNhUmhVcXU1WVB2SjBwaXFrOEpFV1ZMUVpIckd3VjdwSzJ0Xzg1YWFRVVFFcU9KaTduTGN3U1BNMWhfRTJuZjNZMFltWkg1MzV2a2dhS1c1bFV0ZjVJTW5wMEp2bUV1WW9PSVh5RnpLZzgtUGtnRm5QZmFOUjJR0gH_AUFVX3lxTFB2Q1hJUzBjUzFSc05xbXpTVW9FeUdDZG5sd0pEOUQtWlg1V2R6V0EwUVlaeHpZSXZlVGtKV1BURDlCVzBta045eEhROUJJN0JUZTUyNHF2eXhnQ0NLNFplLU4wRDBmcVhXRUdJb3pKVVNFT1RVWUY3Ni1ldzM0WU16SHpwYXNDTmkxRmZZbmRfemtIczJURWNYa25DeHpUc3p5VlhlZk91OGhCT1otNXJPelRIZHc2RnVrLW5YUGtNYkt1YjR1djBTM3ZHbElnYk90R3Zlek96MDNxN3RmM0xvdFBsNmdlZWpxWERYN0VVVk15T0V6b2t0eXNfZG9Ccw?oc=5,"Wed, 04 Feb 2026 08:00:00 GMT",livemint.com,Marico acquisition investment,passed: named FMCG company + deal verb present (exclusion check bypassed - trusted acquirer identity),tier_1,1.0
Marico to acquire remaining 46 pc stake in True Elements,Marico to acquire remaining 46 pc stake in True Elements,https://news.google.com/rss/articles/CBMiswFBVV95cUxNcU5Ib1BHRk5zYWM3RHd0OERXWHByMGpxdWFRWnFseEdzc1JSX0lMWmk0M2JuakROT3FMeHhKOW5iOU1fUks0ZkY4b1VDRkZpRTg3Qm9pWjU1b0dtTDhUbWJEOUxzNGJhUlMySi16eTBJTGM0dEFhWjZxblg3eEJfbUZOZkxRS3BGWTFySzM5QU02ZGh6STF6UEZjSEFCMUZDNGl6RXFCTWVib3JCdUllWWx0d9IBuAFBVV95cUxNNGcyZndBajdDR1FBZEdwZlhlUlJXQXdLX3ZLSkp0VFZjQlJwYWdpNnlKYk80NHZNRmVCamZ5X3hUU3RkTUI5Qng5Smo3Q0xjVVNKZTZqM0hzNXVPSHVoZmxPUmh2LV9ONVlCbjBabHFlZ0gwV3BXNjlxS196eWVYV25KeFJTMFYyTThNdGFYNzF6Y0VSMk9SdFUxOU5LXzNDQ2VNVmltczN0dDkzd05TRXlTNzI0MV9F?oc=5,"Fri, 12 Sep 2025 07:00:00 GMT",Moneycontrol.com,Marico acquisition investment,passed: named FMCG company + deal verb present (exclusion check bypassed - trusted acquirer identity),tier_1,1.0
What’s behind Marico’s seemingly insatiable appetite for acquisitions?,What’s behind Marico’s seemingly insatiable appetite for acquisitions?,https://news.google.com/rss/articles/CBMiwwFBVV95cUxQeG5jcTFtei10bmo0d21Cc0lWOXVVeW9nLXhFd3RPOHRMMy1TLUROSUFyR25QNGFNeTVvWkJDdDNvajEzQklBSnlaX0ZIbDZrcjJIWGdCd0luNkhndVFqWTFYYlB0SlVKb1ZTNExJanFVRE56X19rWHhFWE1zWko5dWg0WFpqaUNRRTRnS2YtNHlwaGZuTzUzR1RqRkpEdUVQYXY0S0x6N3YwVmNMNEgzS2t2N1VYQzI1T2RXMmotVXJmbk3SAcgBQVVfeXFMTUN0XzVqNk5INDROZ3h2aXhxVGJtekRld3BnR0dwZ3c0VWdqb2o4RUFUWDk2SjFJdHJReFRxXzhCQ042NS1kaVgyRFR5SXJGY2RpV2Z1N3hrcVlPOFByVUtNajlvSlV6MUFRaGR6MFJ3Vldoc3NaNFM0RlctX1JoamcycXdnVGc0T0ktdkRPejVOR1dPOEI3eUNWMml5NWFQSVdnV1JTekQwd2MtdlZOa0lqVU5Vd0dYd2NKZlpyVnpoaEFueUFMaFc?oc=5,"Wed, 11 Feb 2026 08:00:00 GMT",Moneycontrol.com,Marico acquisition investment,passed: named FMCG company + deal verb present (exclusion check bypassed - trusted acquirer identity),tier_1,1.0
Marico to acquire 54% in health food brand True Elements,Marico to acquire 54% in health food brand True Elements,https://news.google.com/rss/articles/CBMi0gFBVV95cUxOd1ZyeDdPa1FIbnlPZnVRMmdVQUs1UWk4ZnlwZFU3TWpWWnluWjk2SjI2MU5sUXZzbWpuRENZaUg2MThtNlBpSmZDU1pxWlRuNEdFaGN5dEd2MW5lRGxyX2dBNm8wS1J4RGd6VFNtd2tNbklRM293ME9ISlRRUWJEN2gzZFg3T25rNGQ0U1ZSOWc1WG5MM2xfQTJBd0lrdy1VdEZnNDJ0SExtWFJ5UDhCdDhWRTdzN2dJVW91Q2xMaEFHd1dpZm95ZHJwSUFyRXNHS0HSAdcBQVVfeXFMT0lkWVhkNk9kbm9hVVJEMG9EQ1Nkd0hSNUNKREVyR0NUNklxcDBaV2VwLUNsb2RoenVIclFIZl8wckVJdGN5VU1icFNPVmcwaTgtR1NTSGdSZU9qODRvN0g3ZjdxcldNVEVWYmZBUUtBSWlFczBMRDN3bmFjZGY2aFBDUTFMV0hrNXZ6WjdLUndvNHE3OTRrOHhZTHU4Yng4UXlwOENhOUJxVlM2MERHU2JobFkwZGl2c2k4T1o1QUFJV2xkSHdJaFI1eG1NdWdNNllLa2gwQ0k?oc=5,"Mon, 23 May 2022 07:00:00 GMT",The Economic Times,Marico acquisition investment,passed: named FMCG company + deal verb present (exclusion check bypassed - trusted acquirer identity),tier_1,1.0
Marico acquires Egypt's hair care brand 'Fiancee',Marico acquires Egypt's hair care brand 'Fiancee',https://news.google.com/rss/articles/CBMixAFBVV95cUxQNnJsOFNWbnZrYU9reTNoUGlta2ZZTVB4SzFxUm0ycnRiUXpXNEVhZUNZc2FIWUVxdU9EX3VCMW1qSFVDY1o5NlUxQmdpT01XQ1NQdkRFbUZtTHA5WnZzeFpjaW13N09DYmhjSUJVN1ZlMmZhc1RVUVBfdWZ0U25GSWhJZzFpSzcyeFRBaTlxc0Zqak5IS01IWS1PSkV5WVlaVElUYVhMNzQ4UVlaUEtITTZUTlRIeDJvcUtyMlFDS2xreGwx?oc=5,"Wed, 13 Sep 2006 07:00:00 GMT",The Economic Times,Marico acquisition investment,passed: named FMCG company + deal verb present (exclusion check bypassed - trusted acquirer identity),tier_1,1.0
ITC to acquire 16% stake in D2C natural personal care brand Mother Sparsh,ITC to acquire 16% stake in D2C natural personal care brand Mother Sparsh,https://news.google.com/rss/articles/CBMi3AFBVV95cUxNZG1vR3pHanpQS29lVUJwQ19vN01Yb2hHUTRJVWxHWDNlTnFVRDF4ZEp2QVJYTEJ4SVV6ODFndmI2WlRhMnBYZFNlM3VqZjBVV2pvOHNjVjR3MGhlUlFzOERnTGpURi13WDFfeFoydENUN2xPMDcyTjJLekRjenYzNU5Da0hpY0x6ZjNaMl90N1NlVE5VS1l4bUE2VUN0dXdvcW03LWZYVnQ1anItTUdtWDRlWEU1bkNENm8taGxGV1pPVUxFYkluM2FMVmNQNmlYVTRVdFBsWTNRdTBv0gHiAUFVX3lxTE5xVUZFbVNnSHlMcnZLQ3BfVFBhTjQ2Z1Q2cW40U1VoYktBcTlnNktKM2VLalJoRkFKdTh2cVFNM1FvNTZOUXZEQ25nN3VFSVF3bFJnUExPVGJMV0EwV1ZiQjV6bDdpZllCcEJpNHZOb3JsRlM1OWFEZUlnNlo0T3UtalMzU3pDZzFpcHBZQTNGQjFONDE0amkzUFRsQVlLRngyZWgzSExaVExyOEhzLW1UQTRNTzk4VWFYTlBaa3Uyb1gwUllST2JTUnZvVnB3YldsWEE2TzJ2dllYaU9sTkxIMFE?oc=5,"Sat, 27 Nov 2021 08:00:00 GMT",Business Standard,ITC FMCG stake acquisition,passed: named FMCG company + deal verb present (exclusion check bypassed - trusted acquirer identity),tier_1,1.0
Adani bull GQG raises stake in ITC to 5.47% following BAT’s partial exit,Adani bull GQG raises stake in ITC to 5.47% following BAT’s partial exit,https://news.google.com/rss/articles/CBMi3AFBVV95cUxOMnFDbmpRcjltV2ZDbHpRZ2NIaU5HaUtHMFd2VDZheEtiQUNIS3RDbmFndG8xdVV6aW5QWUVXYTRBQ3hXZTRuQWxPVVhHQ3c5WTBUT0RvSmFQaWJxQ3Fudzd3UnprM3FmSkhCTWFOc1VHRlRBbGgzMFMyaERQOF9RVlE3SVJwM3VaclpIUENWSGo4MG5JelQ4SWk4SWRIV3V2X2lxdXlsUG9Tb1pTa2ZaaTZYaGtSZ1J3NzB3djBBemRGR0t6a0dhLVk0bnNCdURNTmt3UWhTU1o2ZlJE0gHiAUFVX3lxTE1ZZVQ2M1V6ZU5QeDBOOXBERjVzZ0NUQmtxQTZENExkSGZOcG96YW0zUFUxc3RUak5VWlFGbmVHUlBKYlNULWFkN0NWZDloNnBEM2NzdVpWY0FWbWpFTkI1WkZXVHZ3NnN5MURMVGlnYWc5aTJUWnkzN1dUN1Y0Y2VLbk1uNm1TRXpwQnRYMVFhSF91M19FbXI3UU9fZU5QSWc5UWdzZmVVWW45RGRUMUM4VThKZllUODRZUlVISkpPem1YQTZ4SFc1ODBtU24waVlWMzJCckFaTUZ2cEJDWVdzOXc?oc=5,"Mon, 02 Jun 2025 07:00:00 GMT",The Economic Times,ITC FMCG stake acquisition,passed: named FMCG company + deal verb present (exclusion check bypassed - trusted acquirer identity),tier_1,1.0
Prataap Snacks issues clarification: Yellow Diamond parent 'not in negotiations' with ITC for 47% stake sale,Prataap Snacks issues clarification: Yellow Diamond parent 'not in negotiations' with ITC for 47% stake sale,https://news.google.com/rss/articles/CBMiqwFBVV95cUxOaVNJMGVSTW1MMzNQT1laRk9KT2s1NnBUOXNhRW1DVGpDa0ZZaVFvYTZ1UXdPcW5CSElhOUdDY1g5cDgtUWNlVGsxRGFSYXkxYWE4WjVxOHc3VHlxRWhSWVhWeXdSdmVpcU5LTlloYnRqMUZPOUQwbkpzeHp0RG0wZ0NjWk1UTk83cWpkZnpwcTdQYlEtdU5jQVY3UFJrTG5RSzVGS3VSbERrbGfSAbABQVVfeXFMTzYwajlKR3ZPMkRySnJWaldVTGhmbFZqbFlwc2ttY2xXRnJyZ1gyOHFodjhoejJtQUs3VlN6VnZrQW5RTERJUTFOQ2IxU3haQVY4MjVqYk5UX3ZyekFHWDliUklrS1ptR1hTdFBiaGI5bnBSNXJvQURtelU2ckJENW9iaWxPdDhxdVJYZjlkZ1hUWkJ5OEtvdmg4UWM3bFI4NDJuM0JTZVpJbTkxalBjSGI?oc=5,"Fri, 23 Feb 2024 08:00:00 GMT",livemint.com,ITC FMCG stake acquisition,passed: named FMCG company + deal verb present (exclusion check bypassed - trusted acquirer identity),tier_1,1.0
ITC to acquire Sresta Natural Bioproducts for Rs 472.5 crore,ITC to acquire Sresta Natural Bioproducts for Rs 472.5 crore,https://news.google.com/rss/articles/CBMi2gFBVV95cUxQWi1WNnl3REY1UHpveVlSV3R0ODZadm1NU0RaV3lfYjJOM0pmSjk1Y0ZWOU1tVHdkUWs2QndkT0VPM05JQ3BZN0pvQmlvTDVXX19sTUhUTXdTLXZXbmlSbTRGMEZlSmJzZ0pGRGo2X2Z3MDZXTzZKa2RWandONnpUX2NYT0ppeEJRM2t4R25oV2dwVmpXeFBieFNCX2NqbkZ3d1VKNUt5b2NGQzhMaExXNFNZMjAtdUJzTFFGbmxURTJJV2pBak9KZTZZWC1VT051eWdiWkxIWXlld9IB3wFBVV95cUxOcUlRcUV2TkMxOGNKbHhCcWt0V0JhM1VVc1JUbUFza0YzcTFTcDJweFFYNjRDWVZoYnZXQkFxRlEzOExRNnpLWUZyMnZWN2RYNmFXZnpKaDJ4OWtsdGxmMUE2Q2hMR1lvRWw2amxrNG43TVltZmRmd01tSEltRmRPLXBCV1RUclZZUUhfaENyaXVmTXA4dl9BUC16UUpGd3A5ZUgwNWEyNVgzRzdnLUkyWDZkSzBXZ09vZzJ4RWNYaFVhMzd6UV9RU0pwTkxvTUV2RFJFMENZc041SUxSVk1n?oc=5,"Thu, 17 Apr 2025 07:00:00 GMT",The Economic Times,ITC FMCG stake acquisition,passed: named FMCG company + deal verb present (exclusion check bypassed - trusted acquirer identity),tier_1,1.0
ITC to acquire Yoga Bar; to strengthen presence in healthy foods space,ITC to acquire Yoga Bar; to strengthen presence in healthy foods space,https://news.google.com/rss/articles/CBMiwwFBVV95cUxNSndGeDMxcW5MVVBPOEt5eE5JNFBEaWF0THhza085c1pKLVlSMWdSQS1pcWplSzBhR2FYR0hKWDVjMVJsZjF0U0xmbVkyRl9vUzNESkxUTS1sWWp3Q2dqcGNkMjlIUHptbFZ3UWlZcU9fbVpiLW5icDJMeUx4d3ZTRlBPNVJPRm01MWdwcFVlcDEwX21ITzRpNU5yaVZkQ0k3Q3pNT1NrM3RFWEhtY0VfWWpCdDZBSnJvdFc1NDdoX1Fsd2PSAcgBQVVfeXFMTTk2Y2NBNWI1dlo1clV3M0hPMzZESG9lQzhzY2h2NjNybzFFUnhSNEFRcXZhdkRsWHAzbW9RcHZDLTJfUkw5aUc3b1ZBYTVybEthVWxGNVI5VzhZZTl5WEdPNWdKR1JFemF3a3hUTkpRbTNuZ3kwWjN5UWRfcUJUWktZam9ocWJsTi13WFhsRGp2cERyYjBPNUhySlI0cFBpTmFNcVJLR19FSXl4TzJJTzFMMDEzOW50S0RjUkJyZHdJSnJvUVhBYW0?oc=5,"Tue, 17 Jan 2023 08:00:00 GMT",Moneycontrol.com,ITC FMCG stake acquisition,passed: named FMCG company + deal verb present (exclusion check bypassed - trusted acquirer identity),tier_1,1.0
Pure non-vegetarian: Why ITC is acquiring frozen meats brands Prasuma and Meatigo,Pure non-vegetarian: Why ITC is acquiring frozen meats brands Prasuma and Meatigo,https://news.google.com/rss/articles/CBMi8gFBVV95cUxQYXlfVG1VdUZFSFdheW1PclZFMVFDaXNuRGQ5b3ZfXzJZN0ZvNXNQZjVNZXZKeHZfWnQ5SkxKX3F3RFhyYXZKd1VDT2xockhkbXNrZTBNZnRycW5rdnFBbW15X2RLdk96MDNGeXRuTkhDTG9vdld2eGZwckFMNUpUMGhCN0huWnJjN0Nhb1RvNURnU0ptdzJDcmptVEVDRVpscFFoUFFKdUJJbTNLSlNFTG5QN3V1elNhdXhiYng2ZzZHTWkzY1N5SG14N01lMXhXMDZmZnU4Vm1fMWhGNGVaMjY4NkpwQWpQVmNvalVkWEFEQdIB9wFBVV95cUxQSkZGeTZYQkJxRlJqbGtwM0VlaU9BN1hsSVhiaXV4YW5VTkIxYkVwZGc5RDZXQS16RmhtNTBOalhZUk1oNHZERFpzOXNoVS1MZGtRcWcyWGoydXN6Y0doZHRDQlgzZXRURXQ3VDk5cGVxX19PYTZYZVBPN0R6ZC1zWXZIeDBQbVNaUldWMElKQ0F6WkVZRWRrU1haWWNlTVBYY1h2YkdJeEh6ZkRGS3k1bEpLSFVmdERQYWtQYzlNenExTVUybmtIZlVYRE5wSDBCX1pJMXFwa2JpQUpDcjhmTDUxTzM0T1FGQ1l2V19RWGVOcUFBUFNr?oc=5,"Tue, 18 Feb 2025 08:00:00 GMT",livemint.com,ITC FMCG stake acquisition,passed: named FMCG company + deal verb present (exclusion check bypassed - trusted acquirer identity),tier_1,1.0
MC Exclusive: Godrej Consumer may acquire Raymond's consumer care biz for over Rs 1000 cr,MC Exclusive: Godrej Consumer may acquire Raymond's consumer care biz for over Rs 1000 cr,https://news.google.com/rss/articles/CBMi1gFBVV95cUxPLU8wbVhyYXpwWnJDUExaaDUwZ3huSTRtOFZ6SGxhaFVibEloSllhT0tQdTZhQy1CY1pPU0FBUmY2MUVUVlNWOTNzT3E3Q1RYMnJ1U25fUXd3R001OHVsQ2g5SVMzVlljSlBxVDhhenNZeFYtMFdOMlFIaVV3SWw4UHdoeGR2NHJJZXRoR2xQSmJ1RTVia0dXUzFHZTBVNWFOWVdPdGNvWUJZcjRMVUo5Y0Q5SkVZMWVqLW5fVGFrWUJxUjlTcENQVGlZQV9JNXRNaGprYTR30gHbAUFVX3lxTE9GZzRveGc2djJxdzZUcVNSS3JRRzFIaFRjMlNpQ0hSN3FUSktWaFdmbi1Sb2pYSXNoNW11cGJwdjRjOTFoWVJYNWltcFZpLWYzaExlVVZkZXllNzF2dkpQUHVidVJYTDBGdDJxN25aeFdmYUpJZWlMWlQtRXNtVUZWOURRbVdhbGVJZkt3azM5djVCMkJYeEtpdFhidU0yREVCTHVGWnlUSHcwblQxTGlNcGQ3Mm9nSVBQTWdaN3M3N3ZlMkx2eUE2NGVDaWdFTWo5VWEwalJpMlBXOA?oc=5,"Thu, 27 Apr 2023 07:00:00 GMT",Moneycontrol.com,Godrej Consumer acquisition,passed: named FMCG company + deal verb present (exclusion check bypassed - trusted acquirer identity),tier_1,1.0
Mamaearth parent acquires premium beauty brand BBLUNT from Godrej Consumer Products,Mamaearth parent acquires premium beauty brand BBLUNT from Godrej Consumer Products,https://news.google.com/rss/articles/CBMitAFBVV95cUxOV2lmRVpYMGdwdmJSZ2tOOVBsUW1oMElGcG81VWl1b20xZEc5dWp4bTMxNHJUckM5SWxUZW5HMThTd3B4aEdoWU9OaUxoVUpkcmE0TWRoc0dPWjRYQmthWl85c1pXYmhTam92eVVQRUVXTUE0Z0RPRmdrYkxyNmExeWoxZ0dfYmhlSlJTQ1hCRkV4c3BBMTNwdDdTQ3ZTSTNxd1VLdllVTWlGTS1nbW96YlVzWmnSAboBQVVfeXFMTzRfcHcwSFpWaWdFSVJqOTFaTy1WZm16anZabVR4anFTcWdtWVpGTHJ2RDZVd1gtVW55ckRtckZJRFBFRFUxUXFmc1E4Zzh0ZTFsU2JMMk5uZGFzSHBzU3NhT2M1cEItWk8xTWxwMXB0eFZDNWlVTkJudmstU1I4NnhkeEx4NVE5ZVBSVHNVckhDNUIxR1VZRW5aOXd4NXR0ZnVNRjRFbnl3eGpRbVBvckJGWDBzcVJfMmJ3?oc=5,"Mon, 14 Feb 2022 08:00:00 GMT",Moneycontrol.com,Godrej Consumer acquisition,passed: named FMCG company + deal verb present (exclusion check bypassed - trusted acquirer identity),tier_1,1.0
"Godrej Consumer to pay Rs 1,050 cr to buy Sara Lee's 51% stake in JV","Godrej Consumer to pay Rs 1,050 cr to buy Sara Lee's 51% stake in JV",https://news.google.com/rss/articles/CBMi2gFBVV95cUxOVkJaRjl5OFNrNWhSZkE3c0prSGZxLUxDWm9xWVVZRE5uTUJBbUhVYjhiUUJ0WGVzRW9WM1d6c0ZGMWt0b1ZIWHJEaVhNdE1sdXM2dk40c05vM3M3cXNtUTE2X19EcjV0RmdfSFZ0YTM0azlidFNiNVE0UC1rdnppSHVuWWotY0xQTUtrUWdfdWVleWNNWGdMQjNvS3NxcWlpdFpWc1dkcF93bmc5eG1TQ21LcU82ZUs4Y2RrZng0XzJkWlJqOHhuTXFkOTV0Qlh6R0hKdEh3aFJTZ9IB3wFBVV95cUxPM05oZVRTd0h5SWY5dDk2LXBmQVA1bEtSN3ZCdThsNS1UYW1SdzRzUC1tVng0bGpVMUxwLXAwRTUzRE1nMnZaTnFvcEkzSGNvQjdBMEw1SjFzNmcyaWNQUkhsMi0yZzc1QVNTSjlLZkNIUllMQU5VeVBBcXk5SkJWbEJtZEFBSEhLa0JzMzdnd2lnMFZyN2xCdHowNXhqeWtzbDZZUEJzZ0N1aEltZDZDaWhCaExVQ0x0eFY0b1J5SUNLYmp3dEg3NW9zdFc0OHFIQWxyT3g0dDU2QnNScEFj?oc=5,"Fri, 14 May 2010 07:00:00 GMT",Business Standard,Godrej Consumer acquisition,passed: named FMCG company + deal verb present (exclusion check bypassed - trusted acquirer identity),tier_1,1.0
Wadia Group denies reports of divesting Britannia stake,Wadia Group denies reports of divesting Britannia stake,https://news.google.com/rss/articles/CBMivgFBVV95cUxQMGdtOEFkMlFaOGFxbjcyVW9fZWZ1dVhDeWZWNmR3ZW9IOEFnTmlLQlhHemktSlg4amN6MjN4dXlYckhIYzhXTnR1XzI3M0NwMGxJaUE5cXVoM2pfQkZiMUhOUGpYdnk1a1k5LTlocFdOVGhMenlSYXRseUZBVmdLTlhzbWZ1UWVVTmQ2YmRZREZ2TlcxcTNyai1ucEpEOVRRWGsxT0lYbkFKT1htQXh1YXMzNUNxT3RLelJkTlZR0gHDAUFVX3lxTE9BSDNTNV9teDZxUzZxM3FrSVZFZm9RQnZDbTk0blYzbGpBelJ0Z0JjTmFRRHUwbmNBc0lYN3FHU0ItMVN1QWE3bWNBQUtKdEt5S0tyRGJ4T29qZzRtLWltbVJTOU5IMzUwcy1QcHdJcW1TNndZc0NjVmJRUUcwS3IwZ19GUUR4MDJyS0FES3RzaFJWRnFuNnNCU3RRQ0ZmTnFfVEF3XzdUYlpRTDhhblBxeHMtNE9CNndNQ1lmRzFMZmZPbw?oc=5,"Fri, 05 Jun 2020 07:00:00 GMT",Moneycontrol.com,Britannia investment stake,passed: named FMCG company + deal verb present (exclusion check bypassed - trusted acquirer identity),tier_1,1.0
Britannia in talks to acquire Kishlay Foods to expand presence in Northeast,Britannia in talks to acquire Kishlay Foods to expand presence in Northeast,https://news.google.com/rss/articles/CBMi3AFBVV95cUxPZVpTN2hkdWU4VnBOa01lM3hxWmVLTDZ4RzZkeXRnLXJnQWhXRExGYk5pSVFZRHF4bVdWWHpDc1pnUXZYN1gxUnBTVXhhRjRvaFF4eFZ4TlNuZlNiNmZRTUt6c1pfZDlWeXg2UXowcFJ2TlEyUE5LOTZWcDFuUS0wamlvQ0wwVThyeEhDM09uQ2F4LVpoeGNjRW52S2tzZGNMb0FWSkNLQXlnS1JPMksxNGdOY0wtczZGUUZkeEtQdVl6d2NOSGhuVFYxRnBLb1VjR2h2b1dzS2NDLUp00gHiAUFVX3lxTFB3b3dOSk5jeC1HQlpYd3FjdTQ1QjhCSDl3QkxiVWozMmVPaHBmRWxKN0o0S2FoeVl5R2d1aUtwNVFoT09jcC1mVlNIOU5FMkpfY3IyWWZjRnVUWFQ1blRyMldaTGd6QmNJdjRSaXQ0RWM0X016elBzMXVIa0lLZklLU2QzQXVUcnFnN1BvaVpiTVhoRTM4aUFCR293UGFWakxBQnhXRDlOQ1ExMjY1MmNCLUdIVjNiLXhWOE5DcmhmMUNaalp2a3U3anFSMmpPMDJpRjB6TmNObUFYUjNoZE1jT1E?oc=5,"Thu, 05 Sep 2024 07:00:00 GMT",Business Standard,Britannia investment stake,passed: named FMCG company + deal verb present (exclusion check bypassed - trusted acquirer identity),tier_1,1.0
French cheese maker Bel to acquire 49% stake in Britannia's dairy subsidiary under new JV,French cheese maker Bel to acquire 49% stake in Britannia's dairy subsidiary under new JV,https://news.google.com/rss/articles/CBMi7gFBVV95cUxNQWp3aVU5amVMVncyTHlLMnNCTW55djZna2c0V1RuY1ppcHZ0bFFkTW9NWHZldHFQekd0Ym53YnRJN2o3M25VaFRlOWNvaVVEa3RMdVNzTXJrYk9mYzd1VmpLZXFYUFhIcksweDJraVFjVWxzbmFfQnpxbTUxTk5JbXVfQ0c2WUJzMmR4a0lxUlNJa0hPZW9SYlFNMnFFNzJIQmhUNnY3dndQTDAzaXpSbllWa2xWdGxqbjJqd0toVU0tWERoMVctU2J6UHRfTmJVeWw2MkpQa09pUnVBZEVZVVlScE01dDRFSThid1Fn0gHzAUFVX3lxTE8yT1hUTDNnZmV1b1NKTUJBYXg1N0M0SXdZTmlrNFFyX1BJYlFyYkdud3l5YmpPRk9GdHo2SVVOeE55UjlndWt3OUJoNk1obno0SUUwV2xCTXdRQmhOb1BRcnU4QzRKeVl3NEYyRlFCTmRLekdBTmUta0dSbm5vV0YzSWUwVktET1dTbTVadlVQYzJqeHVQQXZ3dXhqek5BUTQ4OElDeXVNemo5NmowcFI5aXZsNTZvRnlCdXFhck8tN1dla0Z5SmNpY3k3a0xQWmVFQnd1SURjb054UWFNVzQ4N2VrZnNob3E3UDRkdllaVzF2SQ?oc=5,"Wed, 30 Nov 2022 08:00:00 GMT",Moneycontrol.com,Britannia investment stake,passed: named FMCG company + deal verb present (exclusion check bypassed - trusted acquirer identity),tier_1,1.0
Britannia forms joint venture with Chipita of Greece,Britannia forms joint venture with Chipita of Greece,https://news.google.com/rss/articles/CBMirAFBVV95cUxOaEo1c2dxX0I0dlJjR0NtaVBKNVZuUV9KRGMyU2dnUk1BV3ZfenZ3ZTNRX29ua0pSY3BBUXFDNmdXSmxiWTc0d2FqOU81ZkxGa2FPWnc1azMwbHdDWFYtNU5yVW0xbkpObjJGMVpDdE5WQWxiVWdMVFVTWHhqVUgwampWTGtwVElTSDEwYXB3MXZXUkZPenVZZXhEaklud3BuQlJjYnpndXRtWVhE0gGyAUFVX3lxTE9yWS1QamlKbUN3SERtdlg2WnNlQm1taGw4MTdoRGlLbXNtSmo3UVJ5UXRsaWJMQjNwMkR3YjJpYzRDZFNNTE9JbnNvTG82YUpyU0Y2OGlZU25XUGtUemFpWGduakpMZkZlZkJVSDVMYmpmeGJUa0VLU1UzeWhUZDI4bTZ4VTBHUHBzSTF6MWEtdjN2cmhYcThkbWNKX3ltZ3llXzZneEh6UXhsdjlxX2sxR3c?oc=5,"Tue, 28 Mar 2017 07:00:00 GMT",Moneycontrol.com,Britannia investment stake,passed: named FMCG company + deal verb present (exclusion check bypassed - trusted acquirer identity),tier_1,1.0
Tata Consumer close to major Danone buyout in India: Report,Tata Consumer close to major Danone buyout in India: Report,https://news.google.com/rss/articles/CBMitgFBVV95cUxQVWI1cmZnV3MwZUltNkRwYi1JQVhNWmdXTGRZQVZERDByR0tiVUk4RGZRRTE3Rkw1NGY2NEd1Q2piZzV5Zk1HcWk5cGRmLUFLR2ZrLU40Y25PM0xYckM4cy1SQ05MdE9mZDhmSG94NGxJR29ZNEx3NXAxdzlGZ1hsUjlBeTdIS3V6VGZMcWVsSWtyRlZQdDFCOEc4T283Q0hZNG15dHBrLVJoVmZtdlBaZnJabXo2d9IBuwFBVV95cUxNcjZsNzhYUU5UUUppbUJaNGVNeS1QNUg2RHNpM1l4dl9DUlR6NlRBVDdCMEw5NGItNi1kZko2R0RpOWpzZmNhZ0ZSRTRWQ2NDcDg0ZlVYLXgxMjBzd1ZvV05DQXJFYlVHeGhFRVJ5Mll3cUo3RC1HRzhxX21lWU0wQzUtWkh4UzdKMFpuYmIzWHhhMk5BNzJ6VFV4Qk9SR0NmNGRqeGhJUVlnWHdNTElEUTRmbTR6MmdJMGFJ?oc=5,"Mon, 08 Dec 2025 08:00:00 GMT",Moneycontrol.com,Tata Consumer acquisition,passed: named FMCG company + deal verb present (exclusion check bypassed - trusted acquirer identity),tier_1,1.0
Tata Consumer's acquisitions seem like good buys but its valuation screams 'goodbye',Tata Consumer's acquisitions seem like good buys but its valuation screams 'goodbye',https://news.google.com/rss/articles/CBMi3wFBVV95cUxNdHFjUmR2RVhUNnFPN1R2QWp1Yk0wYXNqcjlVdldKOVVZUm5mM3l2UEY4eXRxZk5CU1B0SWtKX0NqR3ZrZURMVlQwV09nampiMXZCZG4ySnkzQW1EY1JNV084d3NvZ1RROXpvUm1pR2hqMnkxd0s4MlNpYW5kZzNYbEFwUXZOSHJoYk4yOUstekh0Y25PWnh6UmxhOXJLakhQM0R5LTRDRXhuTGVQRzZicy1vQUlvdXFHQ0V6TTJ6dVlvUFNMV1lFOUVGVmFUTlBySHFkT3BZVVdQRGVTMjVB0gHkAUFVX3lxTE5YV3phbmd4X1U3UXZobXp5amhjekxuSDFFRjVxLW16d0JJRHFUQUxiNU53NkZGWnJVV3ozcFJWam1GYlpPTHZfVjdoem5sd2ltWmhDNUtaaW5rVXVNdm9CYnUzX2lNdmF3bmxqY1UyamxPVTZObndUajlrbFAxc0NHek9CZTZ1WVRYUmRmM0k2NHFVdTE1NlhrSVFtU2FZc2RodW9kTHB1TXhFVzhoZ01xQWhhSmwwb0xzOTF5alNCVk9aY1dweWh6cjZJblZ3SmV1SjdMWjR4ekhscWV3NlhZa29RbQ?oc=5,"Mon, 15 Jan 2024 08:00:00 GMT",Moneycontrol.com,Tata Consumer acquisition,passed: named FMCG company + deal verb present (exclusion check bypassed - trusted acquirer identity),tier_1,1.0
"Tata Consumer Products plans Rs 3,500 cr rights issue for acquisitions","Tata Consumer Products plans Rs 3,500 cr rights issue for acquisitions",https://news.google.com/rss/articles/CBMi1gFBVV95cUxPLWJ5UXVxci15Q2tJeGJTOXo2cHpwdWx1SVp1MTI4TVcwTGxYZFc2NjJBNXFZSjlhTVFQeEZtR0hSRmMtdDNDcjdVWHMxemlKcTcxRVhvNEt3T1EyWGVvd0pMRHI1ZTNEaEVHcW9LVnZPUkMzdHZhYjVSRFd6bmVWMjZ2Z2NOOUlDQXlwTElyTmhpRHczcHNXNHNmZFlyVHo4TVc5NjRDanJvbF9DLW9JMGtCZjY3R2VKcFRQQjZJQzByX0trN2hKM1I5TWpQTXFMdEtaUWpR0gHbAUFVX3lxTE40V0k2cEhCLTNrbV90bGdHSTRmVnZsQ1c2NVNFbVV3ay1MQ2lOZ0sta1pEdTV2cnlZaEhhcXI5dnBmMXdzd0JDc2tJd2E4enlFbGR0WTJBVHhld1JWTGNZZUhSM18yLVVMemFoUTI1NW9BVDU1V3o3RXNwcDVpekl0c1VPWUp5X2dBbEhJV0NXeFUzRGZKQkptbWxtWV80eTBkQzJkdEhWS2xWQko1TmxDUTJRTGJvUURUazJEZ1JITHZVTFl0bzNpZFhwYkVxandYZVA1OU5qSFNkYw?oc=5,"Mon, 15 Jan 2024 08:00:00 GMT",Business Standard,Tata Consumer acquisition,passed: named FMCG company + deal verb present (exclusion check bypassed - trusted acquirer identity),tier_1,1.0
