title,text,link,pub_date,source,search_query,stage2_reason,credibility_tier,credibility_score
"Hindustan Unilever Elevates Foods Business Focus, Plans Portfolio Transformation and Ice Cream Demerger","Hindustan Unilever Elevates Foods Business Focus, Plans Portfolio Transformation and Ice Cream Demerger",https://news.google.com/rss/articles/CBMiywFBVV95cUxOTHBwZzdxTDZfcjlwS2dlNWw1MllZRGRIYTFkZFZJMUdSV0tQUWhFLUI1QklHSWdsMDk2T3ppWFh2eG1rdzRGdldBc0ZOYTh1QWdHNy1jVWZ5eWRWREhnZk8yS0FOcUw1UTlmd0lpd1dqMHRzLVdzdEJ1SXREN2xkZTNzdW9wMldHdGl3eEY5ekNxYVRnVjlLLXI5QXhFSlVBbVhsY09xMjI2eGYySmE4OVE5dEtVZW55NFEzSXVlc3ExZk1pd0xvV1hSVQ?oc=5,"Fri, 08 Aug 2025 07:00:00 GMT",scanx.trade,Hindustan Unilever acquisition,passed: named FMCG company + deal verb present (exclusion check bypassed - trusted acquirer identity),tier_3,0.3
"HUL Acquires Remaining 49% in OZiva for ₹824 Cr, Valuation Jumps to ₹1,682 Cr in Major D2C Acquisitions 2025 Move – D2c Insider Pulse | Voice of the D2C Community in India","HUL Acquires Remaining 49% in OZiva for ₹824 Cr, Valuation Jumps to ₹1,682 Cr in Major D2C Acquisitions 2025 Move – D2c Insider Pulse | Voice of the D2C Community in India",https://news.google.com/rss/articles/CBMi7AFBVV95cUxQZDNHcXFVVXNGOHhIMTNGVThvMF9vb2p1cGg0R09uaVRRTVc0c09iLUZQRTkzSmdvbHFRY0M3X2Y3VkwyemYxLWZLalNyZl9UamZjSExxZGdHQlNzc0xhMGhUaENIREZGT3ZSUVl5R1NGbjZKMjZnX1ZwRFA0TWJzTTBMcU1keXdocXdnNXhNWlF5OHhDcXU1SW1KemNQcGVnNnRRTHlCdE51Yl9ScHA5alBWY1hwQ0ttdzhMMWxSeWw4YXc1WXlXMTRBckJSWHAyMWpyTkRybDZyS1pSRl9fTXp4RDR0TllibzBYeQ?oc=5,"Mon, 16 Feb 2026 08:00:00 GMT",D2c Insider Pulse,Hindustan Unilever acquisition,passed: named FMCG company + deal verb present (exclusion check bypassed - trusted acquirer identity),tier_3,0.3
"Hindustan Unilever gets CCI nod to acquire Minimalist in Rs 2,670 cr deal","Hindustan Unilever gets CCI nod to acquire Minimalist in Rs 2,670 cr deal",https://news.google.com/rss/articles/CBMi4gFBVV95cUxQUlF0WFZVbm9HdVRtSHEzQ3hwc0hESF81SlFDLW1lODhPaXBfTUlhOEx6WE9DR1A3Z0MydE9BTlFkQ0Uxa01ZSUY0dDVaY2FtY1pBaXhjdE41d0U5WFJEdnRQeDA4MU9neE43YWk4S3JkNHIxQ0RYOURvcmc5aXYyQ1p0QjBEbFI1VjZWMW9pTDFGb21NNDdwVUx2VGxWM2FhWnphdjdETEtFNmliWFhmTElZQm5JSHlxYnY4Ym8wczRlUEI3WjdmLU9zLW9OdUt6aGdnX21nck5UeUdLdjlpTWlB0gHnAUFVX3lxTFBJYjJoLS00cGI1TXZXdU8xQXFXZnpzZGpyYkVjbEFoYkN0cG5Hd2pIbVNSNGRJdVVoTGlLNGR3V3E1UDFMdGRGcWVlRTRCbEJwVzNDMkotNmNCN0ljMGNVeVByZnVuc2F5Q3hDaTVIODZoMTdpd3Awd0F6SllCMEQ4RWozSy1uby1GeDR1c1ZLQXJhSElMZHZ6ZWd6c0VzSkN1NG82Mm93S0ctVDJvZmpBMmIyTndVQkxRd3d0ZWhUek9RSVFPMVM3MDhzQlViS0Q4bkJUZXFPZC1wbFMyZWdKYXNqUGJvYw?oc=5,"Tue, 18 Mar 2025 07:00:00 GMT",ET CFO,Hindustan Unilever acquisition,passed: named FMCG company + deal verb present (exclusion check bypassed - trusted acquirer identity),tier_3,0.3
HUL Shares in Focus: Acquires 90.5% Stake in D2C Brand Minimalist's Parent Company,HUL Shares in Focus: Acquires 90.5% Stake in D2C Brand Minimalist's Parent Company,https://news.google.com/rss/articles/CBMiekFVX3lxTE9tODhDZmc1Vnl1SzBESm9CMWN4WFBqX0k5NzMta2NOX1FRbmhmeUV0SlUwMmNLTkxmazg3WUtxc1dhbG03V3diWjA1ZHU0cXplWFZMS1pxVGdqSlViMHJ0SHZiamNtOVFNUUhmRkZ0QnBnOFZ6ZTNzYURR?oc=5,"Tue, 22 Apr 2025 07:00:00 GMT",Groww,Hindustan Unilever acquisition,passed: named FMCG company + deal verb present (exclusion check bypassed - trusted acquirer identity),tier_3,0.3
Hindustan Unilever in talks to acquire Peak XV-backed Minimalist for up to $350M,Hindustan Unilever in talks to acquire Peak XV-backed Minimalist for up to $350M,https://news.google.com/rss/articles/CBMiggFBVV95cUxPUUFmTmtBaVNwQlNUTUtwU3ZLZmpBUGRyek15QWJNNlItQ21aOWR3ak9oQ2h5SmJ2cWs5V3E4a3ZFY3Bja2ZxRkdaLUtzdU5yY25Ea1p2SHNFVkxTcWJCNkZIc1BFZ1YxeWVrOFpVRzEzclE0ckZrWjJwM1dyLXpFOXZB?oc=5,"Fri, 03 Jan 2025 08:00:00 GMT",TechCrunch,Hindustan Unilever acquisition,passed: named FMCG company + deal verb present (exclusion check bypassed - trusted acquirer identity),tier_3,0.3
Nestle India signs MoU with government to expedite investment in food sector,Nestle India signs MoU with government to expedite investment in food sector,https://news.google.com/rss/articles/CBMiuAFBVV95cUxNZnE5X0pIeTNVMWJzcFJlWVM5d283aGhiMWZIclM0VFJOX3haTW9aLXNRRTcyTnFycjRVeV9fVHRIVUZaNGlkOVN3RWRqdmNpWlI3eFV6cm8tNUxvMXBTQVFzTWFWNzB3YnRodGhEN3FGR0lHM1pNX3I5SmhqRWlNb3gwTjRoaXc0MEdYaVJUSFd2MjJOZ200VEtwNDg2RTJ3ZkZQZ1JkWlFhOVhvS0JhbUZlQnk3clhC?oc=5,"Wed, 01 Oct 2025 07:00:00 GMT",Dairy Business Middle East & Africa,Nestle India investment stake,passed: named FMCG company + deal verb present (exclusion check bypassed - trusted acquirer identity),tier_3,0.3
"TT&A, CAM, SAM navigate Nestle's unicorn stake in Drools","TT&A, CAM, SAM navigate Nestle's unicorn stake in Drools",https://news.google.com/rss/articles/CBMimwFBVV95cUxNUWFvRjA0UnFoM1ktbWpvbWpKSnBBSFVNYmpORmpXNW14S3RKNm5MYll1eFc0QkFtWnVhYmpMNjY2OURRbGRMWGx3c0xxRlFzSktoWW9ZeHZjVjVhSHNoWWI0TllHZGZZbTBRSDRMTUhfSHFyVzIyb3JGTnZ6M1dpdjc0U1JZYzhmMDJfN3pnVHVsaWZYdmlNM0tmZ9IBqAFBVV95cUxPSno4eEZ5YWdrYkZ1bExzYVppVmxfd0hOck9iVWZQR25Ja2dhbXF3NVBmOGhVcWJtUUFIbWJucDRnMWJuSnNvVjZpMWhtWHRuVUF1bDNGTE1WUEkzemNncFo3Y1otdVVvUUtVWFVVT2tmTmIyMW9wZXNHNkZqaHJwdkFUcU1YcGpOWXRLRmxjaTE4X2JwNGlSRFFBckJMSkJCcm1yTFB1QVk?oc=5,"Wed, 28 May 2025 07:00:00 GMT",Bar and Bench,Nestle India investment stake,passed: named FMCG company + deal verb present (exclusion check bypassed - trusted acquirer identity),tier_3,0.3
Platinum Equity sole bidder for Nestle water business stake - Bloomberg By Investing.com,Platinum Equity sole bidder for Nestle water business stake - Bloomberg By Investing.com,https://news.google.com/rss/articles/CBMiywFBVV95cUxORjZiUXVqSFhDQncwTG5waU53Ynd2YWNKeFJFeE5iNXVZdEw2dDg2YmxoeWlORW9wTktfcWFjN0x4MTRPajFYa1NldTh3Wkp6TTFvWnlILUloWFhpd1ltTjZTSWdwSjBNcjZfZDMxVHJkTkFpbWVtWVk2N3JPOU5wM0t2Vmk5TnBpUmwyZmd6REZoQVppYU5lb2NYLXRTRUJYSVV0RUY1MjRSZXBfb3Ixb3A5Wng3bF9JR2Mzbm16SWdzSWVpQjlBS1BmSQ?oc=5,"Tue, 23 Jun 2026 07:00:00 GMT",Investing.com Canada,Nestle India investment stake,passed: named FMCG company + deal verb present (exclusion check bypassed - trusted acquirer identity),tier_3,0.3
Drools Becomes Unicorn as Nestle Joins L Catterton in Strategic Investment,Drools Becomes Unicorn as Nestle Joins L Catterton in Strategic Investment,https://news.google.com/rss/articles/CBMipwFBVV95cUxOZHhzRVU2dFpkSjNYR0hDNTN5NkdEek5la2g5ZDdzSy1wUzlqSXowZC1MWldqcG9HUjZYR285WnBHbkVnTjNGaURHZUx6dEkxYUg5VXJJTDNsOWtDQmpHTG9jQ09mU0FKcmtqb1FNbW8yNS15QldodHp1UjFnWHlkYnduWlBhVFNyUWlGLTNNbWQ1aV90RFBlMlpfeXBFbmcwMmJUSG1SSQ?oc=5,"Mon, 26 May 2025 07:00:00 GMT",Indian Retailer,Nestle India investment stake,passed: named FMCG company + deal verb present (exclusion check bypassed - trusted acquirer identity),tier_3,0.3
Nestle to acquire remaining stake in Israel’s Osem Investments,Nestle to acquire remaining stake in Israel’s Osem Investments,https://news.google.com/rss/articles/CBMimAFBVV95cUxQc0ptRVVNTnRfeGtMMF9DY2VUQlJaamZ0ZnQyMDRjUWhySDV1OXRUWGhsZnI2Vm9Bdm1OS3BleVNVOGloVVJJbmwxdjFsbVVhYnRqOE9HTmEwVzZkRi1XdEc2ejdyZkk5Qm5kX3FxR3YzWHI2ZUlscmZvYTJGSWhiYy1MWlZyOXY5ekxXNmxvZzF4Wko0NzVOWA?oc=5,"Thu, 04 Feb 2016 08:00:00 GMT",Global Food Industry News,Nestle India investment stake,passed: named FMCG company + deal verb present (exclusion check bypassed - trusted acquirer identity),tier_3,0.3
"Aviva ends 25-year JV with Dabur, takes 100% ownership of Aviva Life","Aviva ends 25-year JV with Dabur, takes 100% ownership of Aviva Life",https://news.google.com/rss/articles/CBMi5AFBVV95cUxQN21zTC1vQTFndlZDdEtENkxUQmRiYnUzeXVEQ3BlYlM1RUhYNm02ZlNJSVRHNl93eVhla1Z0X1BVMXcxWVdteWhpUVBIbW9adUs2NVJWNERDdzIwYjBnSVBMNTVVakRxTWpUd0sxT0t1VkhPWEpUSDhMenp0aHdhLVZuelQ2eHdzTDVTUjBlOHB0RWxLeHBubGpjMTJyZzZpWkF4Y19wQTQ2N2tIVDRiWUhxdF9lb0xGSl91OFE5azlCUXdkQzFHOFVRclAtYTJ1SFdENEltdTQxYWFEcktSVFFzbGXSAeoBQVVfeXFMTWJyZVFxQnp6YldxMGtpdTVZX3ZteUc4aV9zbFI0U2kzSlRkbTBUdC1tN3ZJbjFfc0NCYndVbFNnNEpjdjM2Zy1zZkVMdEUtRXc4Xy1IMTYzWkVpOHE1bjVmSmRia1dEeVduYnVrSGVhYzY5U0x0SkJGNno2Xzh4VWh3ZS01WTVtckFOYl9UY1pVeWlBbm56M1hzdUVqS18tMG9BNVpOcUJaT1VfWHdZQWxXV1pyOGxDSHlkMFBlZUJWRjMxamF4Rll4dXdoRzdJMEdvQmtIWldJVk93LWtQQWxlLU5xek5YOGNR?oc=5,"Thu, 09 Jul 2026 10:12:02 GMT",BFSI News,Dabur acquisition stake,passed: named FMCG company + deal verb present (exclusion check bypassed - trusted acquirer identity),tier_3,0.3
Dabur completes acquisition of 51% stake in Badshah Masala; stock rises,Dabur completes acquisition of 51% stake in Badshah Masala; stock rises,https://news.google.com/rss/articles/CBMitgFBVV95cUxNSU00aU1VTFFmR1NwbmpYOGRiY3lBZDBrSzd4aWtNNXpGUE54cFRjUF9XOEtlN3lDRFZHcW5RLXF6WUY2UkdXa2YxYTlCWnQ2TTVEZ0JBajFUQzIwMEY4SHF4eUtKRnVWc3JqT3J3bnpjbVpQTUdIN2JDbDFqUmJZSEJvRG9nTG0waTAzaFVGVzFzUzJhTGRCLW9xVDNNaURCMDU5ZHlRcUl4V0syOEhLdW9Ickc3d9IBwwFBVV95cUxPMlZvME5jbjJUN3NrMXVzWW5oMWpfWmw5UDI4clVqb3VYbUJFV1RxbThQZ0ozQ0FPa3pWTWRFeEFzbDUya3pnMlQwV2RHR3FDSU5vY0tTLUdDazJrTnpMMXlwS3JqdC1hLXhSZndzc3VvRTh0THBaRDRJTWgtRE45NExiMmktZXNFRmlhNUozVHFvdWhqNWd6eHFzejVTVExaLU9iV3pabGFQakhRb1c0bXhDVXAwZHF3X1JrWjZ4cElsNDA?oc=5,"Tue, 03 Jan 2023 08:00:00 GMT",Fortune India,Dabur acquisition stake,passed: named FMCG company + deal verb present (exclusion check bypassed - trusted acquirer identity),tier_3,0.3
Dabur India share drops 3% on promoter stake sale,Dabur India share drops 3% on promoter stake sale,https://news.google.com/rss/articles/CBMimgFBVV95cUxQX0xFWHQzMVdTZWZNdmx1aTFTaTRTNldaaHd3ZzdUYzFtQWNVbDgtSWk2bnIzckdvaF9kSFZoQXd0Y1JjT0VNeWVZRmxKUUxXXzFaSG9aSlVZQTB3QUxoMmdFSnJPLU1pazFQdHpqdUVkaHlpY2FNR21rcTBiV1hKeGdPYjZkV09CQmZuWlgxT3hOVUJjSlNmX2ZR0gGnAUFVX3lxTE54azJrVmF1SGp4WVpZcEZhMTFCZ0FCb2l1aXB4a3JUYUJ0ZDNIY0JCQUNsR01ONlVVcUREWmdUTWR6YWdoLXR1UWdVeTdrX2ptUFVoTTUzTkxIRHkyQWlHUHdvNUhYUlpuWkNQcS0xRzliQnItRzR6NDBtVXdjaXBnTC1xYVJrWV9MWE5JekQ4d1Baay1BckwxX0hKQkJuLUljUDdrMWE4?oc=5,"Tue, 20 Dec 2022 08:00:00 GMT",Fortune India,Dabur acquisition stake,passed: named FMCG company + deal verb present (exclusion check bypassed - trusted acquirer identity),tier_3,0.3
Dabur is the new Badshah in town. The acquisition and what it means for both companies,Dabur is the new Badshah in town. The acquisition and what it means for both companies,https://news.google.com/rss/articles/CBMivAFBVV95cUxOaUlfU3RtZ0owVTA0VldLVlo0N2RzNERYWnJKQlpSdkVyOUZrNXhVYXZzclVtRDFhNG1HZmRqbm1aWWNwSlVyd1NMQnFtbTV3WDZ3WmZ3a2FqVG1KQXBkNXRBeXh1amJZVWs3RlQ0N1BiWTdWbnlNZ3Vaek9LR1lsTWQ5S202WmlyR1dBOXhMaGtGT0JHeGxsczBpU0V1c3NnMFczQzFYZXl4cVR3V2ZrYWdJNXBRaFQzVXBXcNIBwgFBVV95cUxQaWQzLWk5WDVJbjBhMTVaYU9PcEhaSlVraUNWV2tiYWNlVF8zc0x3ZmR3VTVDQ1NodXA4S3gzZl9EaFpFMlp4TWlrd0hUMzRzSXU5bE5SY1ZCMElSWUNvbVBpRFZEMDhfVGZKdURBdE5jUkFCSTR2MHl2UkFqMGN2dDR2eDFULU9IeVNQQWRHVElONUF5U1d6YnRvTmxCcHB4bXIyWmNzSGhsWURYOTdXRGVwY3U1SWVfclZwczFqNGZJZw?oc=5,"Thu, 27 Oct 2022 07:00:00 GMT",dailyo.in,Dabur acquisition stake,passed: named FMCG company + deal verb present (exclusion check bypassed - trusted acquirer identity),tier_3,0.3
Dabur acquires Ayurvedic personal care company Sesa Care for Rs 315-325 crore,Dabur acquires Ayurvedic personal care company Sesa Care for Rs 315-325 crore,https://news.google.com/rss/articles/CBMi2AFBVV95cUxPcC1jSGd1bWxRQmdQcEtQTWVnTTRvOU55alFQYW9uTWdMMS1hNHBkbXY0Z2E3YUVnWTVBM1FBZkk0TF9ZMEsyU05iNTFrbi1NTVZxWTZDVGpwNUFtM2J3XzU5UzBaZlNCNXRyd3VCZHRVWDdTQkRHRksxcnF0ejRWeWtMRkhUVHdSOUprT1Zpa3ZRTWhJdDBFMXpQT1JIeXNjM0djM1o1YmlxdHRSTkxzUEFuVUVJNFloa2FMLTBTUEJYTGZaNWdBMld2ZDctbTM1NmFHdlFDR2XSAdgBQVVfeXFMT3AtY0hndW1sUUJnUHBLUE1lZ000bzlOeWpRUGFvbk1nTDEtYTRwZG12NGdhN2FFZ1k1QTNRQWZJNExfWTBLMlNOYjUxa24tTU1WcVk2Q1RqcDVBbTNid181OVMwWmZTQjV0cnd1QmR0VVg3U0JER0ZLMXJxdHo0VnlrTEZIVFR3UjlKa09WaWt2UU1oSXQwRTF6UE9SSHlzYzNHYzNaNWJpcXR0Uk5Mc1BBblVFSTRZaGthTC0wU1BCWExmWjVnQTJXdmQ3LW0zNTZhR3ZRQ0dl?oc=5,"Wed, 30 Oct 2024 07:00:00 GMT",bestmediainfo.com,Dabur acquisition stake,passed: named FMCG company + deal verb present (exclusion check bypassed - trusted acquirer identity),tier_3,0.3
Gaurav Burman of Dabur acquires strategic stake in Mitsu,Gaurav Burman of Dabur acquires strategic stake in Mitsu,https://news.google.com/rss/articles/CBMilwFBVV95cUxQLVJoOElXQk43RnpmVUNsNnJyT0g4WG9pel8xSlhFRDVncUhxM1F6UElaQ25zYk9kRGhaYVdTSU1FYkZ0UGExVFdpc29YM3phWWVjOWtVbkJyTEpEUm9BQkRKRVdOdmdrNTByUEdpOEIxUzd2cng1eFRjTTB0RWNTV3VObkRVSVVnSk9SWmRTOGdMLTg0U3FN?oc=5,"Wed, 13 Sep 2023 07:00:00 GMT",Adgully.com,Dabur acquisition stake,passed: named FMCG company + deal verb present (exclusion check bypassed - trusted acquirer identity),tier_3,0.3
"Big entry of Dabur into Rs 25k crore spices, seasoniong market! Acquires 51% stake in Badshah Masala","Big entry of Dabur into Rs 25k crore spices, seasoniong market! Acquires 51% stake in Badshah Masala",https://news.google.com/rss/articles/CBMi0gFBVV95cUxQR09BcEVjVmRhZmltREFGdWI0Z3F1cE1fVHI4OGJ3ZFUzc3Q3WGJrRlo1cTlOZ2N4V1BZbzFYVDQ1UlZkUDdvS3YwU1FHRjZPakQ2WFlLd3REbWlCdmJpbnBPTHNBcDZPcmxGeWRfbFZoZXhLZU8zV1p6YjgzX0xqLXB0U2xsTHNIMWo2QVNkZW1qeU9BM1E2NEpwVU9RNW9LdXdUQkE5eHNySnMycGo5YkpOQXlQaVJ1cWc1amhGLUJJeWVjQUhuTDF1LUpLNWdmSkE?oc=5,"Wed, 26 Oct 2022 07:00:00 GMT",Zee Business,Dabur acquisition stake,passed: named FMCG company + deal verb present (exclusion check bypassed - trusted acquirer identity),tier_3,0.3
Marico Limited Publishes Official Transcript of Strategic Investment Conference Call,Marico Limited Publishes Official Transcript of Strategic Investment Conference Call,https://news.google.com/rss/articles/CBMiggJBVV95cUxPY1NfNWhjZ2JVSWJTYjFERFFvQjlUOUpNejhFdXVMdVhtSXM3SFFsTElNZG1ST09mdnhqWWRrUXB6bU1XMFhaemRBRlYyMTJpNGRiNU9SNEN5ZFMzYTJCNnl2b2VCZ0pISzJQWVpDOEFQQkRZeUNZN3Z2VENjOUJ2dXBaYjRLWWV3SEdHYUh1R21KXzktOU9rX3k1NUN3T3BCZUJSZUFmVUFZV0xDMXZHaFNMaVhfS2EyY3diZUhCVTdhTC1QbU1HYWdDVjIxUFZPVkJ0MmtHNmRYd25OSUE2ODJsNGg5Y05NNWRaWi0yWmVLVnBORUdSNWEweWJwa3JHc2c?oc=5,"Tue, 17 Feb 2026 08:00:00 GMT",scanx.trade,Marico acquisition investment,passed: named FMCG company + deal verb present (exclusion check bypassed - trusted acquirer identity),tier_3,0.3
Marico enters agreement to buy 75% stake in Vietnam’s Skinetiq,Marico enters agreement to buy 75% stake in Vietnam’s Skinetiq,https://news.google.com/rss/articles/CBMizgFBVV95cUxOcFl1TmNKTkhzY0lfRWM0VzRMS1Q3UU5ER3YyR0pQN1hGcG5QdlFSSk5wYmRHLVRvRXdfOVZyZWtoeG5RWkpnTHl5V3A2WURhMW5mSnd0N2QxQ21QV3JOTXBqN3dxVHl4WV9aQUpJVDBGdEo1a2JUczUxS09SNVlERkJmQXl0VGVsMDdGajR2Y0o2QjQydTcteUhYenM0eUUzcnBBTmRMcEFQVlNRMnlYSUhEcU1nWGpnRlhxNHl5dUJmanNiU1Qyc0YtakQ1Z9IBzgFBVV95cUxOcFl1TmNKTkhzY0lfRWM0VzRMS1Q3UU5ER3YyR0pQN1hGcG5QdlFSSk5wYmRHLVRvRXdfOVZyZWtoeG5RWkpnTHl5V3A2WURhMW5mSnd0N2QxQ21QV3JOTXBqN3dxVHl4WV9aQUpJVDBGdEo1a2JUczUxS09SNVlERkJmQXl0VGVsMDdGajR2Y0o2QjQydTcteUhYenM0eUUzcnBBTmRMcEFQVlNRMnlYSUhEcU1nWGpnRlhxNHl5dUJmanNiU1Qyc0YtakQ1Zw?oc=5,"Tue, 10 Feb 2026 08:00:00 GMT",bestmediainfo.com,Marico acquisition investment,passed: named FMCG company + deal verb present (exclusion check bypassed - trusted acquirer identity),tier_3,0.3
Marico Acquires 4700BC to Expand Premium Snacks,Marico Acquires 4700BC to Expand Premium Snacks,https://news.google.com/rss/articles/CBMiwgFBVV95cUxOQklMNWhNN1BpdWc2VnBqRXNnek5aSjZRandIaC04d05YMWM0VlRGMU9WZmRlTnVScTZncnFsckZwZk5JdlR5ZHk3Y29OM2k0WWtkYkJ0d3pfUGJHR2FVZG5QTTZtclBzeTMzbnJ1ZFFtQjRvN0RvR1FMMHdxWnpJTGRFVERJdnFQNnQzUG5ac2h0Z3VCQV9McnZ6N2loS0FJemxwX3hLRlRkb0l2ZEZIYWRFeWI4eGFPLWMzZXZJWThwQQ?oc=5,"Tue, 27 Jan 2026 08:00:00 GMT",Passionate In Marketing,Marico acquisition investment,passed: named FMCG company + deal verb present (exclusion check bypassed - trusted acquirer identity),tier_3,0.3
Marico Announces Strategic ₹2.26 Billion Investment to Acquire 60% Stake in Cosmix Wellness,Marico Announces Strategic ₹2.26 Billion Investment to Acquire 60% Stake in Cosmix Wellness,https://news.google.com/rss/articles/CBMi4wFBVV95cUxNNmR6SW1Tamc5eUFGd3ctaXVQSHh2OXR0VTk0M2xMOEFLWHBfRzZ4ZTM4NDgyZWU0ZFhkNm9WSDB2MHprUHg3TmhhNmh0YXcyRGYtU0RSVmtBVmpzb0Y5SGdWbDc4Z21TRnkwcTZWTnpVYUxsZ3gxakVRNzU3MGtoeThyVTQyUkZFcFVEX3Q0RFVxaHA5SnNKQmUzWDBMbG91SzhUTU9fWGJrTnJnM0VsZFh0S1BpakhHalpSMVRFZ0ROYzhBNlJRZVNvNWZhVk1DODh6akl0R2FZaHdRS2JLSTVJUQ?oc=5,"Wed, 04 Feb 2026 08:00:00 GMT",scanx.trade,Marico acquisition investment,passed: named FMCG company + deal verb present (exclusion check bypassed - trusted acquirer identity),tier_3,0.3
Marico Acquires 75% Stake in Vietnamese Skincare Company Skinetiq for INR 261.6 Crores,Marico Acquires 75% Stake in Vietnamese Skincare Company Skinetiq for INR 261.6 Crores,https://news.google.com/rss/articles/CBMi3gFBVV95cUxPTmJoRDBTaHNBZFJJY1pDaWJSaklPM0padVVSOXZXWlVUSFpsVGp1UmxDdHJoaGNnR3d4bktfd01CUG9aSlFyRmM4d0VFb1ZGNHJtSk1KWFRabGpBMjJmUlkydVBCbzRkSVpidndmMEFKbk9nNVdUMG5DWmc4NUEybUNOdk5mWkV6MlVlX2JxWWo2RGxYYXNIbWVEYnlKS3ZGd3FkOGRTS191c21tMk1ybjluR29mQlpfSjJzSEVGN3ZhQlllb0FKd1dvSUNyQ0JTN3poYnFtMTl6dTIzZlE?oc=5,"Mon, 09 Feb 2026 08:00:00 GMT",scanx.trade,Marico acquisition investment,passed: named FMCG company + deal verb present (exclusion check bypassed - trusted acquirer identity),tier_3,0.3
Marico to acquire 4700BC parent Zea Maisie from PVR INOX for ₹227 crore,Marico to acquire 4700BC parent Zea Maisie from PVR INOX for ₹227 crore,https://news.google.com/rss/articles/CBMiuwFBVV95cUxOUWM0eTJ5cHBTeTA2S0FLRDE1QlJOWkNDOV9TVDRKc2xBNnlGZ3VBNDdrLU1sdGw4X084NWxVS05RTTVxMlJRSTE5WlZiM1dnaEZpaEliSkF1WHB4Smo4VzFSaUNMb2xoQTl4OXlXM1lMQWNOdDZLWHZiYzNNZ3h3eS0zeWVLT0RpT1BZcGpFNktaaDVhTWdRZFhWeHhlaFFlS1JGRVNwbll5Y3FEOWlGVFNPUWJHMFh3ZHJz0gHCAUFVX3lxTE9wSUU4eUZ2dTdBcEQybGpVbktQbmNOUjRHXzQ2cnBmbFgyT2t3S2JoeEtUMzVDRG13Rm15T1A5OTRWeHAyU2dwenZiUEt1Z2hyY3BweXlsc2ZzeGhoUmt0Y1ZERXNLZTJNUzZDVlA5dm1xRFFmWEFpd213UWEtSlpwSU5MdXNyczc0VkNnRHItWkRtZkpQaGduT3NqQnpzUy1aa0dIcHJrMjQtNmduYjMyNUNDOExfR00yNzVRaXdrUV9n?oc=5,"Mon, 26 Jan 2026 08:00:00 GMT",The Hindu,Marico acquisition investment,passed: named FMCG company + deal verb present (exclusion check bypassed - trusted acquirer identity),tier_3,0.3
"Beardo, A Portfolio Of Venture Catalysts Acquired By Marico","Beardo, A Portfolio Of Venture Catalysts Acquired By Marico",https://news.google.com/rss/articles/CBMiowFBVV95cUxQd0hMai12UlRCa3R6YU0ycjYxU0JLVkxzM19kbEVldHNmX2NDOHlELUloblhMRW5uS1E5YWNzdjRqMHJ1UGFidm4wcmNUMEM0VDE1dEVDM0lsYXlSOVg4dmYyLWxaTGpaVkVWWFMyTGdtbFlZdjRITmIybjhYQWxFRFpIb0Q2Ry1OMmxrQVJ5RjdtdDZzbFMySngtVFJ0cndkT3NB0gGoAUFVX3lxTE56b0hMTXltd0k5Ml9vU3pGRldQYmt0d2d4Ym9jZGlkUHFjM2ItT2N2UTg0bG9KeFVXelBkQlhWUXdZUlA1b045S1dXWV95UjF4R1dhMnE0aGttU01yc2pnV3llU2lfWDZseXNCb2szSy1ES3JHRkxtSWROUHM2TEdfeGwzTzhTeXZPbDB1cTlZb0otQlRRbTVET2JyVlQ0eXlaVWZzV0FNXw?oc=5,"Thu, 02 Jul 2020 07:00:00 GMT",Express Computer,Marico acquisition investment,passed: named FMCG company + deal verb present (exclusion check bypassed - trusted acquirer identity),tier_3,0.3
Marico expands its food play; plans to invest in new digital brands,Marico expands its food play; plans to invest in new digital brands,https://news.google.com/rss/articles/CBMinwFBVV95cUxPclBjdllaUnlQN3EyeXhUODRXT09ucU15TGdUTDY1eWhhYTUzbmdaQXBwTHNjTjVNTDExWlZIdVRyUnJ2dktmczItZEZWRWI0bndjQVJCeXlBeHpCbUVmdXRjc1E3eWR0U1pVeHBoaGUzbDhfa0V4eGNCRDVIb2JoMUc3WWU5b1g2bGp1TXl5UXRhRnpBU0dDZHhLQURFbmM?oc=5,"Mon, 02 Jan 2023 08:00:00 GMT",afaqs!,Marico acquisition investment,passed: named FMCG company + deal verb present (exclusion check bypassed - trusted acquirer identity),tier_3,0.3
India’s Marico buys 75% stake in Vietnamese cosmetics firm,India’s Marico buys 75% stake in Vietnamese cosmetics firm,https://news.google.com/rss/articles/CBMilgFBVV95cUxQTGQ1aTFrVHZPTGVHbTl6VjdneWlrYmVFZWNtVXVQQ3RTTUR0N2N5eHVKbWh6dFNLYkgtei15YXlYcjFhbVBfX1VwUEZ4YlUwRmdyZ3pTcjhpTnZnUTVrTXRuNEg4aE9RdURwbVVlaGlHa2Z3bnFhZWs3cEJWVExZaVZna2pwRU1GQU1GRndHYzlBSkFFVWc?oc=5,"Wed, 11 Feb 2026 08:00:00 GMT",Theinvestor,Marico acquisition investment,passed: named FMCG company + deal verb present (exclusion check bypassed - trusted acquirer identity),tier_3,0.3
Marico creates Rs. 104 crore impairment charge for investment in youth portfolio,Marico creates Rs. 104 crore impairment charge for investment in youth portfolio,https://news.google.com/rss/articles/CBMi8wFBVV95cUxOb0pWRENRREVmeGVITlhHQ0ROYjdYdTg4XzBJcUd3eGhRUTI2eDNUV1MyR2tXZy1zYTQ0cnpXb0YyblpFdmNUTDZYOU9pS3hvdjVOTFNnTm5Lb2VVbzFYcklmRGQ2S2pMOHZock9RQzBfSHd2cDhrVUZieU9lalZuTTdlVUk1Rks4Skk2bTVRQUZJWjFXWFdhcnRRZUJndkx1Z0pFaW1acFJtb2ZNUTJVN1I4aTFLaWxBZDFuVWgwOXFXVE9VcnQwR2pnOTltX19YZDZBLVh0OVlOZ0VMZU5NbEtHaWo0dnJyeHJiVmVfTVF0eVHSAfgBQVVfeXFMTk41Nl9jUWI4eC05aTQ5eFJ3SHVxVnBNd2dXQ2FEZEJxdi13U3dYVFByR2hmQzFFc3pNcUF4X0hMbWFOZm9zMElMQUNlRTZlU0Z5eFR3M09DSHJxbGY0TXZtSkJmNXB6Qm8tUFlrZzQxQ1JmSkVFZ0ZwUFZDS0lDYzlpYXF6WlBCWmJCZGhhdGlzdVh6M3paWUVoaF9YZzNqbklmMXV2d3RwQzNSUmhGdTZpZ0kyZVRjS2xGNk5HX1FtSGJpVUczUGFfNnpGTkpBX1d0YTY3TnpoRG9sZVhpQjFLQXZwV3AwVUlOaTZ5QVVYNnFLRU5MNnc?oc=5,"Thu, 03 May 2018 07:00:00 GMT",ET BrandEquity,Marico acquisition investment,passed: named FMCG company + deal verb present (exclusion check bypassed - trusted acquirer identity),tier_3,0.3
Marico acquires majority stake in Apcos,Marico acquires majority stake in Apcos,https://news.google.com/rss/articles/CBMihAFBVV95cUxNMjZoRGFudFBYMlhWT2FvamhqdElDemZtNG4tZm1ER0Y2LXUzTmVuNmg0TTJsMmVvNTNnVUlUcGtFM20zWFFuVlIxSUd5aTFzRk1EdlBzcUJpazc2QXZYODE5X25tZ21oNWtsQzhiLVpZdXBXaVY2U1JkRW1tOXZOZFZMblE?oc=5,"Fri, 16 Jul 2021 07:00:00 GMT",Passionate In Marketing,Marico acquisition investment,passed: named FMCG company + deal verb present (exclusion check bypassed - trusted acquirer identity),tier_3,0.3
Marico expands Việt Nam presence with majority stake in skincare firm Skinetiq,Marico expands Việt Nam presence with majority stake in skincare firm Skinetiq,https://news.google.com/rss/articles/CBMivwFBVV95cUxORWNnM183bkRLd1YxcFRBZXJVcmQzc0ZiVjhxeHllSzkzakVsODh6SW8tU2J6NDJDcXZrQ1pPS3ZvSVpjamFYRG1PUWxVSUJDdFBYU1NSVlYxbWhlOUxKV0RxZmlYTEhxS1dkTHRDdVBZcWwwTWM4ZFZHYXkzUWhvNWVzOHlyN3lyZV9WeFowTnlSaDQ4bkdsZFZkY09JN0FlQnhNOU9CQThfbFpDSU9vaDNQV0pPR1hiYzg0QzllMA?oc=5,"Tue, 10 Feb 2026 08:00:00 GMT",vietnamnews.vn,Marico acquisition investment,passed: named FMCG company + deal verb present (exclusion check bypassed - trusted acquirer identity),tier_3,0.3
Indian consumer giant Marico acquires Vietnam’s Beauty X,Indian consumer giant Marico acquires Vietnam’s Beauty X,https://news.google.com/rss/articles/CBMikwFBVV95cUxOZmtwdGVOMlBCWnQ0aTVDWkRtdzkzU2ozUzF5b0FHUThvZ2xFcG5KbGFUT2xEdlhpajRvRVVQeDFVQVRSY2VDaFJrLTNhcV92NmdQRjUwZXpVV0x3U2RSZ3EzaW5QbmlUY0lEOUFQWVB2cTE3OXltQVFocFBCMGdTUlBaOE1yUkU5UHRnTWZtLXMtRUk?oc=5,"Sat, 10 Dec 2022 08:00:00 GMT",Theinvestor,Marico acquisition investment,passed: named FMCG company + deal verb present (exclusion check bypassed - trusted acquirer identity),tier_3,0.3
Marico Acquires Gourmet Snacking Brand '4700BC' for Up to ₹227 Cr,Marico Acquires Gourmet Snacking Brand '4700BC' for Up to ₹227 Cr,https://news.google.com/rss/articles/CBMi7gFBVV95cUxOZVZIMFN4dlpmUlc2R0dtMFZDenllTUtWQjg5YjNybTg4X1NyMEU4ckxOSEpmaHQzbTVXSEN2eS1VTDAwUjRaR1JiWHNMWEx0QUtqbU5yY2czYldEaFJCNU1jQlpEWUpYa2pmcERZT0h6bXhpTGkwdU5SZ0dnazNqTTF2VVFIZkJwYjR2MTk5a2hMNjRKSkNJdXk5LWpCVGVJRWdjclM2RjNINDF2b1NtdWo3TDk0WWJURkoxRTlsdWdOSWpmRkFWeFNUV0JuYnhBcXNKYlhwdjg0Ul9jZ2c1c3B3Q0NyMmpEQU8tdlR3?oc=5,"Mon, 26 Jan 2026 08:00:00 GMT",Whalesbook,Marico acquisition investment,passed: named FMCG company + deal verb present (exclusion check bypassed - trusted acquirer identity),tier_3,0.3
ITC Limited raises stake in Mother Sparsh to 49.32% for Rs 30 crore,ITC Limited raises stake in Mother Sparsh to 49.32% for Rs 30 crore,https://news.google.com/rss/articles/CBMiygFBVV95cUxNWmtvT2xIdms1X0ZWR0pfNUhBRWl2WEMxLUh4TFBDSUNwRmlsVkpucDhwU2RGM2RKUEgtQWtZdWNHaGNMRi11UzYyYmlaTHdETFhOa0ZsRkM4Q0RXbE9rTmFYUG1FcGRhQzlHeGVmYm1OazRMemRTMDg1TnFLNFlBWC1BNlU1U2xhQ0hkMXdxc2dNWWtackM1ZlQ5TXJ0SUlaVEZoWHRUNm5xeUdoSFVoWFRRZUxxc0RoNS11eTVCT2xVYUVGZC1EbDBR0gHKAUFVX3lxTE1aa29PbEh2azVfRlZHSl81SEFFaXZYQzEtSHhMUENJQ3BGaWxWSm5wOHBTZEYzZEpQSC1Ba1l1Y0doY0xGLXVTNjJiaVpMd0RMWE5rRmxGQzhDRFdsT2tOYVhQbUVwZGFDOUd4ZWZibU5rNEx6ZFMwODVOcUs0WUFYLUE2VTVTbGFDSGQxd3FzZ01Za1pyQzVmVDlNcnRJSVpURmhYdFQ2bnF5R2hIVWhYVFFlTHFzRGg1LXV5NUJPbFVhRUZkLURsMFE?oc=5,"Wed, 20 May 2026 07:00:00 GMT",bestmediainfo.com,ITC FMCG stake acquisition,passed: named FMCG company + deal verb present (exclusion check bypassed - trusted acquirer identity),tier_3,0.3
"ITC on acquisition spree: Buys majority stake in Mother Sparsh, 24 Mantra Organic for ₹554 cr","ITC on acquisition spree: Buys majority stake in Mother Sparsh, 24 Mantra Organic for ₹554 cr",https://news.google.com/rss/articles/CBMi1wFBVV95cUxON1ZHMnZHOU1RdnYwTGFXdzhZTzc2VGZ5a3VDelNDUUJTUTVwczZlWU9CZk1ra0phdWZPQnBiR2JKaXZlMDY3a1dqNkFNN3BQcXFRcXZuU1lFUTBERnM4emNtMDBEWWhxMGNTR2VreG92Qk02QkpxMDRPbVNCZEtIc21abzJtNGM4LTY0QkNFdV8zZkNyNGlFSTl3RVBNeGxCTXJ4QVl1MjI3TEJyZ1pLWkcyeG5MR2NqYjB5YmxiSTZkVEM2ekRsMzIwbnhmUW9wMkE4SXB0MNIB5AFBVV95cUxOazc2MlduWnEyRm5Wcm9VMVRDX0RkNDltNVRnVkpQSHRmYVJsVDcwX24ybzdiZUhmUUR5WmRZZGJWcDJTTjFwNVJOd1h5ZTVlV2VLVk1xVUdtRDJfOExDckRrRjViZmNTaVpVazFZMFZGV2htV09wUmZJVjZxcy1qU0FTQjl6ZVRDaE9zTU11UWVUOVVWS1NRZi0zU2d3UjJjTkpuUV9zSXNkSzZoNGtmYTJLR1ZOZWRzTTYzUWVhMWJxNFVDX1N4VndHLVJsaV8yQUtwTVBpYTRXSjVJMmQyMGRhYUU?oc=5,"Fri, 18 Apr 2025 07:00:00 GMT",Fortune India,ITC FMCG stake acquisition,passed: named FMCG company + deal verb present (exclusion check bypassed - trusted acquirer identity),tier_3,0.3
ITC Acquires 39% Stake in Yoga Bar Owner Sproutlife Foods for Rs 175 Crore,ITC Acquires 39% Stake in Yoga Bar Owner Sproutlife Foods for Rs 175 Crore,https://news.google.com/rss/articles/CBMipgFBVV95cUxPUEJHRUtYd1RfNXVVTDctT0dOSmFLXzhwaEV0OU96eGxaWFpFd1BGclpfblNyN003Y3RLdEQ2cWwyN0pWX3V3NlhlQWlwZmFxWVRpUm83T0J0VlFJclYzOUxCUU1KNWlYZjhWQlMzbi0zUWZyWnJoWnV3Y3g4dzhuWElVSU9GaF9OVGVxZHJoQzZaUFplcFRiSEFsd2pwc3Z2NnJoNkxn?oc=5,"Fri, 05 May 2023 07:00:00 GMT",Equitypandit,ITC FMCG stake acquisition,passed: named FMCG company + deal verb present (exclusion check bypassed - trusted acquirer identity),tier_3,0.3
