title,text,link,pub_date,source,search_query,stage2_reason,credibility_tier,credibility_score
"Dabur to acquire a minority stake in the luxury skincare D2C company RAS Beauty, for Rs 60 crore","Dabur to acquire a minority stake in the luxury skincare D2C company RAS Beauty, for Rs 60 crore",https://news.google.com/rss/articles/CBMiiAJBVV95cUxOWTBSSFNqMHlPZVNOM084T0NwQ1Fia202UVFTOC1RRGdobzdGOEFlaThxMzFsTTlsQmRHSjdFdWhxLTJBY0IwTmx2R0pEQjIzNnFxcWVSdkNuVWpHdk5pX21hcDNodHRnQTZydEhTUzRpUTVmWFNhN09heF8wajJNdUhITEFVbENOd21uSjVNd1pUSmYxNnFuNlFZM29aaENmQzVMajJ1R1dKVUc5WWJQbjU0ektBd0JVbmdCZ3NYRW00OVVJZWExeTN3dlRHQ0MwX0RVM1hEWWN4aHBmSXpRLXp4N0VEbXhtSjhMZWZDc0xPUkJnckhpNGhHV3RoYUhDd3R3U29JemHSAY4CQVVfeXFMTUNseGFFVVhCcDZIenVoZm9KY0VCc1BNdEMtMDJTaDR2clR0ZFlqSVdLbnNFcldsVmduYnRyamh5VFJEZjVNZWwyRGFBdXAwQ0NNR1dPY1FaWTZkcmpoLWRJUkNkeFFmc01RYXdRdFcyUkpaSHF4ZEFLcy1QTGdQRkdhazh5SUduVS00MWNhakpWejZkZHR0cURoTENFT0hQUlFOaUFXQUdHMS1fTU5sOENaTndGRWduMm9GT3VJeElOQjZtM3lSVWVHR2d6bWhMTUh1eEljdlFNZGxUVHdxVUQyc3FvTm5BdUxIOHRWXzRqbVpNZlJqOEhXVFlFTExJQVhPZDZsLTdhVVMtQ2NB?oc=5,"Mon, 02 Mar 2026 08:00:00 GMT",The Economic Times,FMCG acquisition India,passed: named FMCG company + deal verb present (exclusion check bypassed - trusted acquirer identity),tier_1,1.0
Emami Ltd to acquire 100% stake in Axiom Ayurveda in deal worth up to ₹200 crore,Emami Ltd to acquire 100% stake in Axiom Ayurveda in deal worth up to ₹200 crore,https://news.google.com/rss/articles/CBMi8gFBVV95cUxOUDN1RnhjNVBaZlIyZDlUZng1bi1wT2tIVGhvU0xtYVJWdGQ3VjM2LUJPVWxXVFl2RUJCUXhoaGt1N3ktUTJiWHBOYVJVUlV0cFduelpNb3ZGa3J0SkQ0YlR0RDQtWXQ4UkF3dzdtakplb3JyM0hza1gxbzU5cXhIWkFqUFdyRHRGNWVZV0M3SWt2S0tUSV9IeV9kcTdmLW53V3hZd1JHYWxVcDdvYVVNQ2NtQUI4YU5KQjVIOUNhSkNNUnRDdnhsUDZXVG8tLWoyVnhNNVJjVjEzMFlQbF9rbWhvN1BBUWc2M0ZaZjdERTQxUdIB9wFBVV95cUxNVGVxM1FwdGFBbjMzOVdKUVpGdTJZR0J3MkxXVzJEZ0R4SGo0aElDdU9MMWVBQkRNSlFHUklHZjRSTFdmMVRrNW9ta2ltWGdockFEaFpEdlZKMEcxb0pKNTdYcDdNdE5fQ3lGOXJNTVpIRDN6T3lRWnlHbmxIZnpibUttX1BvUGdhdFF6Z1lGSDQ3RU5fNzB1NUItYktRV21vY3RNMzdtUjRKdzRRLXo0TTQ4Vi1hNjFNeXk0cWhQdEhxWk5MUDZURU9Scm1wcWtJQkpNVlVvTjZIMHItQmlVTVgyd3U1Qkx5SEtvSmRubld2dEtDZDdn?oc=5,"Thu, 02 Apr 2026 07:00:00 GMT",The Economic Times,FMCG acquisition India,passed: named FMCG company + deal verb present (exclusion check bypassed - trusted acquirer identity),tier_1,1.0
Marico shares to be in focus after FMCG giant's arm announces ₹261 crore Vietnam-based Skinetiq acquisition — Details,Marico shares to be in focus after FMCG giant's arm announces ₹261 crore Vietnam-based Skinetiq acquisition — Details,https://news.google.com/rss/articles/CBMilAJBVV95cUxQRzVvUEhUYk9pUHc4Y3UtZkdvZ3c4Y3dUM0pNLWFaNjNRTkhEaE84WEcxdFk1UHJJd0RVREhlX2tmTXBHVUpWWUl3dEdycDhkSlRkWVVjeTY0ZG5tNW9ncF9NNjhzQzJOM3dLUEJEQml0SUpCSFVNc0dYQmFhYTNneGJKN2RrS3ZjeTdKWFQ4RjlVdERQeVBlTUlfeTRMOFZBaWpLRHJrZnc5Rm81WFpVV1NZbnFzRjkzUzN4U0pybjhvVTRyS3c3NkZGeEYwelFnRm16dHBXbEoyY0JrMlVHaVlDNDFEWHE1YUdpTVBtQ0RrajRpLWlEUFhMSXMyWnhLckJwQ3RtTldzZl9mVURNNVZacjbSAZoCQVVfeXFMUE9MOGxVNXZVLUlWbFJiMWVGX1prODM0YWRaczZkYW9uYVM2U1lJRlVodWhwT2tvYVVoa0VUazNXZkhkWk5DeHJqUHg4NkEzUGpMd24yWTlySXVOV1haUHB2VjZoc1I3YzB1QjFhblM2NEFpMHdNVmExbExlWGZPNUstWVU5SkdXX01oQXEzdnhyQUU3X3RpSFRNNnFieGdIN3NSaFA3OTA5cFhCeWhSMGo3WlpVMjBZdG03dUdkNFE3dTNUallZbm4zZVh3a2gyU0FKZnpLdXFWcEVjS0FxQVQyT1VoSFVPQ01NQmxDM3RVaFNqcGZWNmRsNF85NmFYdzBidG1ldzNGSWMwaGtFTW54MWVnVGkzTVln?oc=5,"Mon, 09 Feb 2026 08:00:00 GMT",livemint.com,FMCG acquisition India,passed: named FMCG company + deal verb present (exclusion check bypassed - trusted acquirer identity),tier_1,1.0
Godrej Consumer acquires Muuchstac in Rs 450-crore deal; promoters to continue to run business,Godrej Consumer acquires Muuchstac in Rs 450-crore deal; promoters to continue to run business,https://news.google.com/rss/articles/CBMihgJBVV95cUxQVHRGaUYzRlViOVVaU3dSdnFBYnpFSHRkTFZTZTdhNktmY0l3SHRrMUE4Mm9PRjAxR1JMUUt4b21jN3VUclFtSnlSR0xUZXRyXzVRdlF2RzFndFQ1RG1iU1pMSGk1cTZZSFoydHVwY3ByRlFhYl9FbEQ4NXdyR3lwMmROX1p5cl90TS03Z1NqNmdrYUZCVmVMeVozdEI3T2N5dTVzNzVmaEpaTUdRVGMyUFV0eDNxX0NrSDBmX0d6V1k2aDhZc0pRd3U3T2NtM2pLX3YwR191UWxJWVVTMGNoeHh5WVRKYjVmczByTDQ5SDkxaHU1Zi1qWWdublFsTkp6VXBhUG1n0gGLAkFVX3lxTE50azZoaDlhQXpia3p3aTVSZnd6RVhabzlETU1mMXZQSjctMDdkVEJ6SkQwMXpQQ0RvcGpyeFhsdEI2ejFOcWJQN00wZUNmLXhJdUU3eTFsbTV0V3JnbHZzQVlKQ1ZZeFZHV1FzZkVkVG0tSkdsVlBDbTdFQ0xoelozbnF4LVhpbms4X2pEZmp2QVJrdFo5NUU4cWNiSENEbWZFNklJZ0tTVHBVREtxeUlKNHJuczlkbk5FN0k3ZlVjdnhGMjBSZGx4UTR0TGlxeHFIMTVCakZ4YjJ3WDhrUzRKLTZFTTRwMDlqTkRwaWpER3NMYlBBVTdnVVFoRnFuVWdXUmF5RndNSHZLRQ?oc=5,"Thu, 13 Nov 2025 08:00:00 GMT",The Economic Times,FMCG acquisition India,passed: named FMCG company + deal verb present (exclusion check bypassed - trusted acquirer identity),tier_1,1.0
Godrej Consumer Products signs pact to acquire Muuchstac in all-cash deal,Godrej Consumer Products signs pact to acquire Muuchstac in all-cash deal,https://news.google.com/rss/articles/CBMi2AFBVV95cUxPOHJHSFdqOXU4ZF9WbFg1cFRpX3M3UnBLanFKakxsdER0cDNzU2I0OWwzU0hMZjc5RlkyUWx1ckczYXJYU3Y1Xzd2cVBHT1B6b0prV09ZRjE4Wi1mb0s3empLRElfMV93eXRvTjZtNDgtMXREMUphVmxrNGVWZEo0aEpoNTFCakVOOXptV29kX1NpdzltOTNKU01KazlIUWVKdGhIeVRVYVhIYVJSTE5fem9JWFdWWGZaUXZtc0dmSWdZaUZBZVRJR1pLV3FxY2x4aWJRanEtS3nSAd4BQVVfeXFMTnpHWldNSjRURC0xNGtXY0dmaU02Z0Q5bE5QMFZxd3RNTWluWktPSWhJSFJOd3kyOExVT2p0eFdRVHR1cWhTVURxVXQ0SVBDRnVSU2c0T1BpRDZIV2FVR0kwSXFsR1RUVU9yQmZUaUZfNVd2ZHBXUGw5aExoeHRnWGwxWHNzWmFNZ2thbGxzb3p0S2RVQThFaUkxUUtienhJZU1STmFFUS1oSVdmbDNjTC1YTF9UWDE4V1hnOFF0azBlRTQ1cmtDTWFyWGhFeDlBcy1aSXlLWDA0ZkpKdWxR?oc=5,"Fri, 31 Oct 2025 07:00:00 GMT",Business Standard,FMCG acquisition India,passed: named FMCG company + deal verb present (exclusion check bypassed - trusted acquirer identity),tier_1,1.0
"Adani Wilmar eyes FMCG expansion, sets aside $1 billion for 3 acquisitions","Adani Wilmar eyes FMCG expansion, sets aside $1 billion for 3 acquisitions",https://news.google.com/rss/articles/CBMi2AFBVV95cUxOZ2NhMFZwbWZweGk0cFYzZ2lfRWdlVENjYldBUUstOTQ0UVVQeVZlcl83M3hHTXhjeUJjeUo2cldMRnhSMWNUNmItaFZvSFNBOVpKRVhtXy1TZGtVNi1EVVd6Rjl1SzZ1MXFuUnVRWjhjX0RKWE43MXVSTFFYU3dZR2IwRWk1Zm1CU0I1YTQ4RVl3NjhoWGtRV2dYM3dxYndwa2pBOC1NTS1FX1FKbi1iMVFyLXdrY2FRSFhpYTlTZDdfRHFQQTNhTGpzS3Z4Z3puSDZyQnotM03SAd4BQVVfeXFMTTZjUG1IclRHWmFLTC1DUkp3NFRJb1RuODBuYm5KNXJCTm4waTYyeDl1VmxZOVFLMVZuMl9MNWJFVlZLU3FXSjRkbjBuTlZZNXM0ZktRQkp5ZjVWRDhmc2FiaFNLeS0zMXh0V24tbWQwc1hVbjc3bmFyRjFwN3k5eHB6c0l6RVBBU2dTdXQwMnR4dHBnVW5ibWNGV0I0SkZ4RzN0NXQ1YU9tTGJXX1gtR0llU3B5RS1objNRUl83UkFkUm14azRaNGVzQVFTSXZITTFqR1pOUXlLOHJZeGdB?oc=5,"Mon, 02 Sep 2024 07:00:00 GMT",Business Standard,FMCG acquisition India,"passed: FMCG entity + deal verb present, no exclusion hints",tier_1,1.0
"The Man Company acquisition: Emami to acquire remaining 49.6% stake, gaining 100% ownership of Helios Lifestyle","The Man Company acquisition: Emami to acquire remaining 49.6% stake, gaining 100% ownership of Helios Lifestyle",https://news.google.com/rss/articles/CBMi-wFBVV95cUxQZ2pLZHUxa3BDclpnYzRhX0EtSU1XZUhiV1p6di04cE02T0NUS1paVjUwUE9TdVVuUW13MTZUMVBXWDZZdFM1b0RpR2t2R2E3YzlrdE9VUmJ4Y2ltRnljOFhLSnQ4MzJJa0UwWk9Ua2c1LUlHdnJ3TmpoY084c0RpRTAybjU3VENsU2p6MkZ4UldmSUdZWUpzd1ZlUm9rNTdnSnhLU3R1ZlZsWWYtdFdYZ0c4YmdENWQzZVVienpKUmVqVmxEbkNGczMteFkwbC1iNWpBRzF4VTZ4WXJ4aUpRbzdUOGd4MTlQQVcxNWtaOFpOOHZvUE1YR3U2WdIBgAJBVV95cUxPZFFRRWFVOU1yN2FYV0dtMVozSHo3cTIwRTA0RGtUakVIZmN4ZWJ6eHVoWURBUU53YWQ3NVBob1lSYXQwb0pqY3ZvUkxpVENxcFpoNXhyeEV2UDNHR092T1NJQXZrQ29GMHFLYXg5aDhmc0xrTzljQW5UY1U1dnBIb2FNUEpRQkhpQVUtelN3MHNWaU0tcXMtWWUtaFZ4aHlhRUxNMzJTM3llQWpHdngzQ2hqblpWOEZyWGFicjN2U3RsaGx2WnpBc1pidEtmOE1GeXdpM0JCN2JhMTdMaGNIZXZQVUMzLXJBRjhLV01QMzlnZEZJcEEtdThMbTZORUxS?oc=5,"Sat, 31 Aug 2024 07:00:00 GMT",livemint.com,FMCG merger stake investment,passed: named FMCG company + deal verb present (exclusion check bypassed - trusted acquirer identity),tier_1,1.0
"HUL acquires majority stake in Minimalist parent co Uprising Science for Rs 2,706 crore","HUL acquires majority stake in Minimalist parent co Uprising Science for Rs 2,706 crore",https://news.google.com/rss/articles/CBMi_AFBVV95cUxOWTZqWUFvRTdabHpJa09leC1QTlphWGYzSFdXWXQ0bXdqVFR0dUdHem9naTZBM2FnWUdkVEZIa0NGdlRnNFMyd082bHJpcVhyUVVnUkZZOU4wNFNvNmw5R0tIMGNuZmxITUJDWE1OdFhnRG5lcHlvdzB4ZGxLUVdkeVAtVjY1UDBBMGFjSVZxcUI5dWZaU0VmYnYzR3FrUDBYbTItVWRpYVQ4VWt0T0JQc0NuSVZKUTRLZ1ZGbkRZekRmT01NckRNdDFlb0FzQzlIZUpOaVVEMTdmQ3BVeEd2WlNGR0F0bXV0eXpjQjZoSXpFblpOSGRZVWtuTVDSAYICQVVfeXFMTTZ2c2FPZjBkblF4NWhKUGhIdG05TTZaMWFhbUROajU2SmR0Z2J5VG85NVVoY2g1cHBMYVlSYTFFdXlHWlM3emd0Zm03cE82R0NVRlo0RkdtREltNDJhWDhySG1YZjRoTUM2ZFprQWJwSWN1RmVXZ3BxaWxFRDNRRmFWM1VwRy02Z3hUdm9rQzlOV2NqMmhxLUR6STB2T0VUV2xCYnk0N3JFeVYyQXVvY1BZUk9SRlQ5YVZOVjBwUDZVNFBYZXVETHZaakZDMF9KdjMwSE1FRzMzRXhaMHp3aUI4ZHZqazdteVVqcHluZTYwWkxWcVlGc1ZsUWR1c3FHenJ3?oc=5,"Mon, 21 Apr 2025 07:00:00 GMT",The Economic Times,FMCG acquisition India,passed: named FMCG company + deal verb present (exclusion check bypassed - trusted acquirer identity),tier_1,1.0
"Reliance Consumer acquires SIL, gears up to challenge HUL, Tata in FMCG","Reliance Consumer acquires SIL, gears up to challenge HUL, Tata in FMCG",https://news.google.com/rss/articles/CBMiygFBVV95cUxQcXdzNWF4VmhxVHhuVDFyUFh1eUw2My1MeTd0bTNGeFZncnQ1Q1FXNzVtUXhxdlJGTUUtQlV3ekUwcDRpTWp2cWFXZkpqSC1XeXQzM01hYnhWT285amRGX3ZvNG9kdkFYa2kzR3JRcDdjVGJlOTJVQzlCX1V2aHFPckhwRkhLOHJFRWhMRlNRWlJWdDVDcmNCQ25TV1l1QVNKRkx1dGJXMFcxVmZNNUJ3RnROVVJrVnl0R2dhNllkenNvQnhGNnI0UzZB0gHPAUFVX3lxTE1lUWZ6UkhpTUNLV1RzWV9uempDUG95aXVEZDRrZkVkdWJXZTI4RUhUaHFrWUVFd1gzRlY1a3l1cmlaLW1CemRmejJpUGsxSWVOVVVwNTNXRm1mMWw1a3ZYeFQwOUx5dFplZENMampsbjk2TlZ0dGhyMUY5U09TV2NqbzhLaHh6Z2k3Q3p1ZEFpQ3hPckwzbXU5clNGOWRkRk1BcEt2NGktSUEyT3pMM1E3X2tqdGx5OV8tczVWcVB0d21LMzBQc2libm9USTFWWQ?oc=5,"Wed, 22 Jan 2025 08:00:00 GMT",Business Standard,FMCG acquisition India,passed: named FMCG company + deal verb present (exclusion check bypassed - trusted acquirer identity),tier_1,1.0
"Parle, Britannia emerge India's top chosen FMCG brands, says Kantar","Parle, Britannia emerge India's top chosen FMCG brands, says Kantar",https://news.google.com/rss/articles/CBMiywFBVV95cUxPWV8wTEt1eGUxcFJxcVhPQ2N6Y0sxYkY5X3MzTE1ONUZBWGtjMnIwakVQZzlaa0NHWnZiZ3FkakZjMDZtQ1ExTWcxNVhiUlpyeWdqS2o4T3pFeEdZcXVUUUNrT3hYblp5UmljaldvZV9zQ3BNOGI4WThzNUdwc2NuQmNUZ0t6aktmc0NfTmpoTmU2RmRBM3VOR1hjZHpXMnpVc3JIbklGUTFqWlFRQlJSR0JaZFhMWnEwNWVkZlpoRWhvb1ZfbjFpSmxsd9IB0AFBVV95cUxNQTFMWXhvVWVRV24tTklpQlZFUE1uZElrd01nWnhERUdiRS1XQTNjaXh0eDdNamNIS1FLVFBwNC1zZDltWFhFNldkclpmZ24wT0F3M0U2dWR2QjUyTzJJUkdfMUktdmtfbmNyMEItRnJQcjQ2RU5uaHFpbzFDWlQtbkNaZi1HT09vQWR6azlrOHA1U0FqemhxVmRkS3JLTVg3NXhuNnJRbm5OUFZEdl9Wem1XbWtDdEptLVRoMmF0amVFRnZYMXpReGl4SXc0RzNW?oc=5,"Thu, 25 Jul 2024 07:00:00 GMT",Business Standard,FMCG acquisition India,passed: named FMCG company + deal verb present (exclusion check bypassed - trusted acquirer identity),tier_1,1.0
ITC to acquire 24 Mantra Organic brand in a Rs 472 crore deal to boost organic food business,ITC to acquire 24 Mantra Organic brand in a Rs 472 crore deal to boost organic food business,https://news.google.com/rss/articles/CBMigAJBVV95cUxPbW9OWTZERXM4TGlzUHNoMnNPTnFJb3lJenJTQkttNDRSSFd3RktMUk1NSXZaVHJ5d1JJVjZIQnNoUzJhUG9sbmdBU0lCQnlqcXVXWEI0NnpVZTJNUHRkaV9hdDgySEs5YWxsRHZzb24xVjZqSUJkMUc2clZYR01LZ3l5bndpdGlUQ1lfeHIzWjhSUkpWNTBSbm8xbm5sT245LXNoZEs5ZjlDbmlPRlRGVjNEYWxfTW10X2I1NlBHbDZuWWd4aHdDMWhRczBPTFdEQ1ZMM3ZBSUlHdlFGRU84c1d2b3JJQk1NQklTZnRJQXNhdHdETjdGM0ZJNmdtYVZN0gGGAkFVX3lxTE5FeVZxRG9menhnMDlPRldnTEk3TnhkVzBqRUNkTDFLNFdVRy16ZkhwR3V3YW5ZUjVnMUtqTFFWQ2lYLTBVNF9jcG1uQ0doVEE4SGYwX21CVFdxTU9BeG5nWS1jcmktbXg2a2NCY2NfVUswX1Z0M2c2RW9wUTBxVUZUQ21Ob09KYm9MODJ2OHp1YzBHd2Y2aDVsczItcC1YRXM1ZWRIOWNYdlRVdGI3cGd6REtVOGdxM2k3MEJlV1FEaWFzYnRlNnNoOVlQS0RnaElQNHVJenV4ZVJ0eU1rbzU0dk5FTDJCWHB1azMwTVdzcDFZZHhtemh6YS1uUWE0ZEZLWFpxU0E?oc=5,"Thu, 17 Apr 2025 07:00:00 GMT",The Economic Times,FMCG acquisition India,passed: named FMCG company + deal verb present (exclusion check bypassed - trusted acquirer identity),tier_1,1.0
"Hindustan Unilever acquires over 90% stake in premium skincare brand Minimalist for ₹2,955 crore","Hindustan Unilever acquires over 90% stake in premium skincare brand Minimalist for ₹2,955 crore",https://news.google.com/rss/articles/CBMi2gFBVV95cUxQcGZJdlRUR01nLXdORnY2S043cFlPN2NRU1Ezd1FETjBuMVRwNmNsZmZRWXJLb01LZFJJSmRndnF5NWV6eHpvaEVlOFVidUdUMlBwd3VtMXdCbkM4UmEwUHJGMTIydXhfcHh1elRKN1FhUmM3dDFCUV9yZGx1dTJsRkRBWGZtaW9INGg2RWJ3ZmxyOHRIMTJSMDVYOVRIdUpsSnItMlhCOWlZOTNuU2hMLS1aOUJ2bkJaQnZUSGNLNnlhcmJuV29rMmlXMWRmTmdVQVI3MWdJSzJNUdIB3wFBVV95cUxQaS1QaDNSeWk5MzltcXV6ZkpRSkVnaVJrclRzaWU5TFZvUnMxRmtkdm5ERklFWC0xZEQySlZiWlBtZWMwTHpvNTNPeExnb3RuVld5R3h6N29fa2dCYTdYcHdNZC1hYktxMzAxd2dOMG1DUFBhRVNhYWE1Y0lrVmZGT0l1Q2R0OGVPSFRiN21UTUFtRzF2cGY4WHY2SXYxUFVHNHNWWGZmYnpNWE5FdWxIMGZqanM3TTJ3SUVnOTl6R0VMQnJOSnpoZjR1T182SERXRHFUeTVGY1RsaUNMd0Qw?oc=5,"Thu, 23 Jan 2025 08:00:00 GMT",livemint.com,Hindustan Unilever acquisition,passed: named FMCG company + deal verb present (exclusion check bypassed - trusted acquirer identity),tier_1,1.0
"Reliance acquires Velvette, the FMCG brand behind the sachet revolution","Reliance acquires Velvette, the FMCG brand behind the sachet revolution",https://news.google.com/rss/articles/CBMizgFBVV95cUxPUGVRbG1PSVlxWEROQVR3WjFKR3ZnRGZNdnQ1alJDaGpDd19DNGw5X2hEck9ZV1k1bmNvMlRRSEQyeGtSS0h0MXRuRWdjcHlLQjFEQVFtczAza3c5QW9UZVFKcVktNGw0bHkwN3Z4blp4ckViemhrZ3k5UEJIcEczZmx3UjJVRTVkNHpwc0tqMGhaeTBwZDF0d0s1X1VnUjNOWEhrUGQtQlZQUjB6ZUVZUUlLT0V6aWhiMWhVRmVkNjJvSkt4YU1pcnZqX3VGQdIB0wFBVV95cUxQbDlLcWt5V2w2Mi1kd002QUc1bzJNMTJwWGFVbWJlQWFVbWZtcG1PaTNPSF8wQjI2TGJNRnB3VWRaVXIyYndrTUtaRzRPcjRsX0oyMDhkaGhTWGp0OV9vUXlKYi1JZ2ZndWlhSUtxek0wZzBFOTBjelBwMGtNSlRZVzVxbVI2cWhDU3NaWUdid2ZTazFzZ19JYXZKNXRzQnlSVUdhTWltQXRFTDhfcy04akdDVDRkd28wUVdyMmVueXVhVkhrUThYUnlxUzU1VkZUYTFF?oc=5,"Fri, 14 Feb 2025 08:00:00 GMT",Business Standard,FMCG acquisition India,"passed: FMCG entity + deal verb present, no exclusion hints",tier_1,1.0
"Nestle to Tata, big FMCG firms race to acquire maker of Ching's Secret","Nestle to Tata, big FMCG firms race to acquire maker of Ching's Secret",https://news.google.com/rss/articles/CBMi1AFBVV95cUxNVWYyVGpqNS1HR2hVSy1vc3lNaWM0a3ZVajVNMnJJZ0tZbnBLTGktQVoxVlctdW1zWWVNX3dNc080TnhGb0V5c0FWRWdUV3EzU0hhbjhCSlVuV2FSNzhoQzdyZktPWEx2dE1CZld4Q3pSYzVfbDdORmx5eVlDVXMwb2FYTDlER1NmSVE2M1RpcFJYUWMyZ3hvRXIwb3dNQkNnVGlZQVBuNWVGcUFYUzRYeWwtRWoxa0YxXzNWSGRJdXBLS2x6dXk1VHkxaFFGdDhfY2R2RNIB2gFBVV95cUxNTmN6Wi1wZnhDc0t2Sm5mOC0zT0hMUS03dlR4LXhRdzloU0xWYUszZEFFNXJubml0SzA1djRmckpfeDNMbUNLbF95QV9sVkl3aUVTbmFDLUZLUHpmTW9RTGRxYll5TE5hM0pSR3kzclZ2eVZKWWdWZTRXNWl6TzdKRjFVMFVOUm9CQzBhVzVEWkt2SWpMX1RkVWg3VUdhdEx0V0NUSzVrQUtUbEVOd05ha2lkVWtyTkVuanBnaWpNUEVlYnlpRnRSZFFydlNkclBESy1TZ2ZZWjI0QQ?oc=5,"Mon, 03 Apr 2023 07:00:00 GMT",Business Standard,FMCG acquisition India,passed: named FMCG company + deal verb present (exclusion check bypassed - trusted acquirer identity),tier_1,1.0
Temasek acquires 10% stake in Haldiram's snacks business for $1 billion,Temasek acquires 10% stake in Haldiram's snacks business for $1 billion,https://news.google.com/rss/articles/CBMi1AFBVV95cUxNeUxBS2Z0RktCT25WRXdQVHdzRTJKR19jOEhkVl9ldllMZURJR0ZqQ3hkdXFqNzcteDNLLVVuZW1RTHEtaklqN25MU1VXQ1RLWTVONWs3eldHamNKc2pPMm50LURWVmMyUDI5WTdTZVhmaFJIOHRZdmo4YjR4NUhRN2FaN3Q5akgtNE5iUTltaW01ZVBILWpiVFYzR01ETFVRbHZWYl92WDh2RWxkLWUwZUNIN1dZczRmUVV5eFM5RUg1ZW9mNFJxZWFEaVhid0ViUUJaZ9IB2gFBVV95cUxPN2RKOGR1bVdmektXOVAzZmNBejNEa1gyQlE0NWFCbXFrZklZc0c1WVJXN3NZTFp4dk1VbXB2M2FMd1c2WV9reG9IYUZzWVZpOHF2OElXYjRMY25FcUpxQUp0QUFJT2tXS0VTb2RzZ3BGcUtsRjdWZHJsZEMtU1RJN01DTUZ3bmdzQzVoLVNQM3ozNG1qOFE2MEtwNlVpUzJNdWNhYVNCby01THpFS1lyUmxpcURnclFfamhMbVJwQkY3YjZ1RXRtbmdSU1FoR1p3d2IzQkVsQjNOQQ?oc=5,"Wed, 12 Mar 2025 07:00:00 GMT",Business Standard,FMCG acquisition India,passed: named FMCG company + deal verb present (exclusion check bypassed - trusted acquirer identity),tier_1,1.0
Marico acquires majority stake in Cosmix as protein gains prominence in Indian meals,Marico acquires majority stake in Cosmix as protein gains prominence in Indian meals,https://news.google.com/rss/articles/CBMiywFBVV95cUxNc2JuMng0NVd4ejdfeEk4aDJpV1NXTzV5Z0M4V2hXdFFZSzlLcThzVGtMOENHRmlDaElMN3BsbS1Qam94d2NWMWZseHRjb3JBZUg3WkoyYUNrMlFUUktlMlNxX3VBUXlSY1FMNlZRQ3VtbzBzeS1jYjdPa2JONTdWekZud0czanVUdWlfbWNRbWJOQmNxb1J5eXhocGZ5Q2docGdQMmxKVXJhd2I1Nzl4UkhCaFZJZlQyTUxIT3FJTkpwQjVpeEFrTFFSc9IB0AFBVV95cUxQOTd4dV9iMDdkNDhXWERyNDNWbUNKS3hfZ1paSVpHa0xzZmtZR2REUEo5SkVFNkQwcVZySjczMlFoTTRzNEZpQ25MZmtYMlQwNGhmZmFpbkRRODVBNnFiYzN1bUVQeDFQS1o4VHZlU1BHcVhvOXowTjI2SDJyS0lIZkJ6MEpfOHZjbHd0Q3dJUDJkbzN6aE9rVDNPc2tjSDNYeE5oRGozazNXYThVdEFiY2ZuVWF1ZFdlblM1Vkx0NGJFalB2UXdLcERncDB0RGpC?oc=5,"Wed, 04 Feb 2026 08:00:00 GMT",Moneycontrol.com,FMCG merger stake investment,passed: named FMCG company + deal verb present (exclusion check bypassed - trusted acquirer identity),tier_1,1.0
ITC in talks to acquire MTR Foods and Eastern Condiments in $1.4 bn deal,ITC in talks to acquire MTR Foods and Eastern Condiments in $1.4 bn deal,https://news.google.com/rss/articles/CBMi1gFBVV95cUxQUElPakpmV2p5bTJGVUUyT0pOVWZsX21oLXBLVHpFUEZWMnQwOWg3NW9pWUZ4R3EyVzF3MC12OUJHVmtjY0FVV0JmRXM4a3VZY3lmMTh3aG1uQmNsU1F0MXFZYWtMRzF4a29QX0xKbkVMMEgxYVllMWR0YnBtT3o4XzItQnZndzFMNDRaRm02eEx5XzduMV9BX0hHbkllRU5LTHFKTGZETnM3ZmJkVUtnYXQtM3ktTXBlZm5qWnMtV3g3VmJVN1BjT3ZuemJSbGZHVGZwSC1n0gHbAUFVX3lxTE1zaTREMnNxX0RwLU9nRUFJZ3NDeTlFUVNCcTlrQ1dWMktkT3IxNktjaldzNGZKbjBtYkVpemp5aC16NEhIYWs3djFaV2ZMam1HVnhlQ01peFZrTUVDaUZRczBRbzNmX1I5bWRyQ2FNZlVQMkZpVDNtTm8yUUtXRGRyd0RaUW9meS02SFBxVl9lTllLd21tU0pzNnVGOGQ4Nzhwa2xzNWdjZnc5ZzgwaFMyRE51aElvbVlOSEtfOW5fRkI0M2FaVUhsRTdGX1Fhc2lrUkNHendEeENvbw?oc=5,"Thu, 13 Feb 2025 08:00:00 GMT",Business Standard,FMCG merger stake investment,passed: named FMCG company + deal verb present (exclusion check bypassed - trusted acquirer identity),tier_1,1.0
"Hindustan Unilever fully buys Zywie Ventures, sells stake in Nutritionalab","Hindustan Unilever fully buys Zywie Ventures, sells stake in Nutritionalab",https://news.google.com/rss/articles/CBMizAFBVV95cUxQNWlxSzVBWXk4QnFoc1BNc3FkWDYyQjNybWVMdmh5cDhueWlUVzEyZThjQUJfZUwtWGtaT0R1Qy1lQ1dUMzV4REllYnNta2lIVG9ER0lhcXJMZEFYOGFrbktPVHR2Vmd4d2ppNjBEN1BMZHdXQ0VCb2xOSjR6NVZxUVdiNW5wQ3d1WHFXUldSRG0zZnZyMzMtbXhDM2hDUnd0Ry1wckVHbk9GUkpKWk1hN19FQjE3UUs4Z3FHVXJDcVAwNmgxa0duaW55U1nSAdIBQVVfeXFMUGlWWU44MzViVkl0ZmxuRmR3RE9leWw1WV82a1lOWDk0MlFERjJDMGJoa3RMTEp5XzZHSlN4a2ExM0huMjJjTThWeHFRZnZsdVY0dE1PWjM5b1NCalVIMy1VZEk4VXh3RUR6cDdzY3pMbzdYVnFrODJVaTJXd1k3dm53bHVieHZMa1FNYmZuM2xxTmsxdmRDZFF6N1c5SU01Mnl2RThJN3VoZGthcjVBTy1qYjlJaXp0anZlNFlLOWdIYWlVNFBabklTMWpnb0xxbGlR?oc=5,"Thu, 12 Feb 2026 08:00:00 GMT",Business Standard,Hindustan Unilever acquisition,passed: named FMCG company + deal verb present (exclusion check bypassed - trusted acquirer identity),tier_1,1.0
HUL to acquire 49% stake in Zywie for Rs 824 crore to beef up 'health and wellbeing' business,HUL to acquire 49% stake in Zywie for Rs 824 crore to beef up 'health and wellbeing' business,https://news.google.com/rss/articles/CBMi4AFBVV95cUxPbDdSb1dzZVVETFVGazA1RmxZZ1dtYjRTR3F3WGhjb0laUVVoNGVnQUptVDVITzIyUzJDUUF3Q1duSmh3VHgyS09HU3hDUmV3andhRjc1d1ZQcXl4OS10R1dxald2d25mWDRYUWo0Y0pJajItdmZ5RnFmYS16cUk2Z0RUZDN0dlJmZnVaMXk5UzRFSGY4Nkk5Z2JVbnBWWlRpSHVhZE1BLV9XeEx2bnoxR3FLWmc4QUY5dUE5Tm0yQVVMTzRDeVlkSldkYU1aSnBEU2U5a0xzUndxbGVuYVQ2ZNIB5gFBVV95cUxPTThrSm85RmFGcFBjT0Z6c3I0UDNfVzYzTEM5cVpPclRlZlhRbHItNUhCT0RSbDBjNWZIaFBRSDRkWUNoRHJ0STJOUkNwem4tMjJXSjFpcXREaHJCbmxrQ21LU1drSGJmdlZZMVpRRHVnRFg4bUJ0SFBWX0JpcktBRWFYOXZlanFCWm5VYUduNndzQ2pvU1Nvalk1RzZJbzQ5ZlE4QnctUUNuQkU3UGZ6SGIweU5rS21laS1fMnpGUzBnQi1wSHRDU3ZmY0ZuaW42RXlvYW0tZlplNkgwdG1XWjFzNEhRQQ?oc=5,"Thu, 12 Feb 2026 08:00:00 GMT",Moneycontrol.com,Hindustan Unilever acquisition,passed: named FMCG company + deal verb present (exclusion check bypassed - trusted acquirer identity),tier_1,1.0
"HUL in acquisition talks with D2C brand Minimalist valuing it at Rs 3,000 crore: sources","HUL in acquisition talks with D2C brand Minimalist valuing it at Rs 3,000 crore: sources",https://news.google.com/rss/articles/CBMi2wFBVV95cUxPbDNBRnNwelJ6Q2ZxWjVjX1Z0Nk8tdTgyTmI4U1hBb1lpeDVNVHZnRE5rdnVBZ3J4ZlZOandCcldLd2pHeEk1R2owbEVhTHVjdGNSTlhzMXlzRUdJRmVpMzRGTklRT21WRjJ2UUx2TGJrMTJqTW04M1JZaGJYemZITWY4blhOSEtDRjZ3czJGNWlpWVR1NmNsUURVSGFkaC00bzctbjVUdE45akR0ajctZnIxMWVUSUlSWXlFanlDMkFjUVFEWFdfWWJUMVlOMElqdG9fa1FaSm9VYmPSAeABQVVfeXFMUGJzZEVwa1hXV3c0cnBhWTlndmtvSGdKR2FlZWJVb2ZEc0N5VFBBeUZhZVQxU2dzX1g0bzRsR3hCZ0lqbGdIN3IyRVJPcnk2MWg5d1o0M2l4QmQySGZqN0s4c0hzN2h0WVp1R0dGcHlRV1locWdMNTZSc1E2TU0yc2xucGNkSkxzVFJxNURXUzhsZFFoNWJNVGJXZXZYN2VuSDFVT3dCRFdvdjdrbGxLYlhjNWlXVklvUi13SFNQaDN0ekNDWUVhNTAxVkVzTlM5SDVGV0czcHVzcV9Kd05TLUI?oc=5,"Fri, 03 Jan 2025 08:00:00 GMT",The Economic Times,Hindustan Unilever acquisition,passed: named FMCG company + deal verb present (exclusion check bypassed - trusted acquirer identity),tier_1,1.0
"HUL to acquire 90.5% stake in Minimalist at enterprise value of Rs 2,995 cr","HUL to acquire 90.5% stake in Minimalist at enterprise value of Rs 2,995 cr",https://news.google.com/rss/articles/CBMi2wFBVV95cUxPY1JWeHZhM0RGQ3ZtVVVJSE1GOGJVUWt2SGJhWGNCejJ3MmJsQ0I2cDFPLXF0eFdEdFlXa2JnbE9BNy1Lem5MSnZGQ1BGRjRPbU9MUTZfYjY5Z3h4ZXFLZ0hEc2V1U0RpWEhmMHE2c2EteFFIUVpOUFlnNGpxSzNqUERwX0JaSXhHQUlqMzJEcV8yZjlaU2N3d3VDWjNvQ19HMWI5Y2hYandkWkdXcFlWVk9nSEV0UUlydHNpODhMTjEyMGpyR3VQZVFaT3FDeUVvcVpEN1BqQ0VQdlnSAeABQVVfeXFMUE1Vbnc0MFNQT0I5X1k0TkI4OWZjQjdIQmRrVUlkbjBRdkZkSU9GNXZHSFFiaDJfWUJ5eV9CVm85b0NmWEJSeXpyN2xBRDNwMzQ2R3BxaEd6bzJBZThuVHJYdDNDX2R6YmgtVnY0Q2J3emd4Y25ITmdwSzFwcVFoaExrVTVIM0F2dHRhU1pIdy1GMmZySWx0R3ZzTTlDbTNILVZ1WnRERFp5OWF1S3h6VkgxRk5qUk92dnotYVdYcDZUWVFybWQzUnpxVU1NTTBUUjY5SXRkbkRpV3lpeDNNR2w?oc=5,"Wed, 22 Jan 2025 08:00:00 GMT",Business Standard,Hindustan Unilever acquisition,passed: named FMCG company + deal verb present (exclusion check bypassed - trusted acquirer identity),tier_1,1.0
"Hindustan Unilever in talks to acquire skincare startup Minimalist for Rs 3,000 crore","Hindustan Unilever in talks to acquire skincare startup Minimalist for Rs 3,000 crore",https://news.google.com/rss/articles/CBMi5AFBVV95cUxQdDJUMHRyU2UxaWxlazlrUER0ckRtczB3VDhuZmo0T0x0LWVMXzRiU3JyQWU5SWVRZGY2R3p1UDFfZTUwQ2xTRm9uQTRFbklmN3kzNzZBNlBXdGxvNlZ6aDR4RU1QWlNfT2ZqaVlPWmJFdE5TX190SGVhR1pPSE1tOFo3WGtGUjV6eWdKaVRpakc4SlJobTJGbmFEdHdKQXdTMjFsT2FZVzZhcTB6UzlVNGdvdjhYQnJoejhZQWVVYWFwSlh2RFBYRTdGcjJPajVvNFlUdjZPSk9OdnIzSzdxNDJnOXTSAeoBQVVfeXFMT0tUbDItNTA4Tnd1WmVLQXFZU1BHa3lqREVHTF9EQ1JsY3c4Y2ZSYUpySjNOalhXQ3hrSkxnTjBtdVVmMFUxbW1TUFJ0cUlsNGtpRnU3SDd3ajdTdGdNRGN1LUtYZ2xsU3diQ00xTGNEbjR1SWNUX1hadnVKbjBBLUpFMm4tTE1MWjJmNUtvai1oZkdrM2J6ckhPQUloSy1hYkhzYXVVWHlvZmFBd0ZsenNmR2lKM0toaW5EVl9xaW04Vk90LWJVUFlaMk55ZTVySmRnTnBmQnIyUU16MVJxUDBqX1BrX2RyZUdB?oc=5,"Fri, 03 Jan 2025 08:00:00 GMT",Moneycontrol.com,Hindustan Unilever acquisition,passed: named FMCG company + deal verb present (exclusion check bypassed - trusted acquirer identity),tier_1,1.0
"Nestle SA makes first India funding, buys stake in pet food brand","Nestle SA makes first India funding, buys stake in pet food brand",https://news.google.com/rss/articles/CBMiywFBVV95cUxOel9sUExhV2xZYjM4RDUtTnNNb3J5c3FETk85N0xmMjV1ZmJVQVVvcC16NHBsOWJrcmZsWkdhV2Z6VGxRQjMxSl9JWF9kOXBsMXRlWDhYNklUbUdYcGdHamp2NmpJdUpyQ1UteDFncGdkd3ZnTk1qQnBoZjVFRDhGcFNlVnBiamtUWXMtWmdZZzB3bGtpYi1rVTBIeE9hVEhWbTlzQ1pKUWhwbjhybjgtSHE5MUlzT1ZnSVJuR29ZMW1iSmF1eGVXcDlHa9IB0AFBVV95cUxNdGtncGdvX0gyM0swVzBrRUFYTzdZcm14WlItLXJjTmhzZkg1T1ZSTmFmWVV2VmN6YmNwM3ZfVFY5OTEzTUhqVFZoX0M0WlJPNld5U0xTQlFnN3Atd3JmUlgwYktfZmQ4bmxoaE5JR3dGbmZSVDlhaTl1eWxBN1NlV0ZuWERBNThtakZRZUlmc05hQklqVHVWWGo2YVIxVnNIUk4tRk94U3Zya2hWQkk1OC0xS2VGVWZxdWNmWHlwc0piZmRWbHFlZmNRSlpCR0Et?oc=5,"Mon, 26 May 2025 07:00:00 GMT",Business Standard,Nestle India investment stake,passed: named FMCG company + deal verb present (exclusion check bypassed - trusted acquirer identity),tier_1,1.0
"Nestle's stake in L'Oreal is a financial investment, Nestle CEO says","Nestle's stake in L'Oreal is a financial investment, Nestle CEO says",https://news.google.com/rss/articles/CBMiqAFBVV95cUxNY052d2ZDaEZXTG1Ta3piNmM3ekFDa0NyVkM0Ukx4Z1dsOGF3Znc0WWlaOUk4Yk9fbzZtc1dhdDJqeVBubnhWdGZISEVURWtDMndTU2xUUmtGOVYzOTROQ2g2aWpSUG5GUkdnU3RTai1Vd3JUOUQyZ2VJQXZjT3ZKcXNRUThoSEgwSkU2RHRUZ3R1S1plcW9TdWtWbndrYnR5MU95YjhBbzc?oc=5,"Mon, 22 Dec 2025 08:00:00 GMT",Reuters,Nestle India investment stake,passed: named FMCG company + deal verb present (exclusion check bypassed - trusted acquirer identity),tier_1,1.0
Dabur acquires minority stake in RAS Beauty under new ventures arm,Dabur acquires minority stake in RAS Beauty under new ventures arm,https://news.google.com/rss/articles/CBMi0AFBVV95cUxQVXQ2X3hPYjVuRlJlWkl0UWY4NDVtdkcxSDlTUHZrTjRLeGI0M0dnM2I5UHlwQmNyMnotTnJRanBDejFXLUk3bG1KN3NjSFZCVkZ2X3Vma3ZyR0J1QnduRlJfa0ZCcDMwTC1ZbEpTVUlpdEFFREo3ZlJkYnFrcjZyaDVEZjM2eXZSMVNqZW51SnhYMUJOdlJtNzYwY2ZHOXEtMFBObElrY015bFI0NFlfd0Z1SmlxMDROV3lZNkNZOEVqaTZHTXRxblI4U1JwRENZ0gHWAUFVX3lxTE1mOU1hNC1hcUpZQUJTZzNCczVpNGREdnRRRW5qcThMQTNxNG5BQk1pNU9JVk1PY2swNFNEYU55WDBfOVJ4d2RadGkzS1EycVVTMnJoTkxGTGRzVENOc0ZlMW1hMi1jdi13d0lUMG1rVTRMc2g2b3ZrRkVVMlZhdW9kdHYyOGdia0ljXzdJcF9rWklsMWVkRzlJM0xkREU3YXZFVDI5dUkwNjJMT25ISkYwZ0ZLOFREeEJwLTVXa0ZoVm9CV3lIMHIzeVNWcVdnRFk1MjhMa2c?oc=5,"Mon, 02 Mar 2026 08:00:00 GMT",Business Standard,Dabur acquisition stake,passed: named FMCG company + deal verb present (exclusion check bypassed - trusted acquirer identity),tier_1,1.0
