title,text,link,pub_date,source,search_query,stage2_reason,credibility_tier,credibility_score
Tata Consumer to acquire Kottaram Agro Foods for Rs 155.8 cr,Tata Consumer to acquire Kottaram Agro Foods for Rs 155.8 cr,https://news.google.com/rss/articles/CBMizgFBVV95cUxQcUsyTzEzYzlyUTJxbEE3UHYtY045N1d4LXkySFIzbGFOT3JyTTJfM2NDaE9SRzFGYkpMcEVQX05RNmtEc2hCeUJaLS1sU1JmUzI1eUxaODUzZkRKc0Y2Y1p3aktMdVNNZDViOEZleGxVQnZCMEpXbzRxNHByRlZfbmVPSEpORDFFYVdBOEkzZVdzZXR1T3A0d0pPWlc3VXNuX3hkT1BVZlA1eU4wSkpGUFZyTzRDT1NfcVg2WUY5UnZuY1JaVmJkTHNhVVRaZ9IB0wFBVV95cUxQV2NrajFuallabHVwa2s5SDhjRkNLYVF0NG9peHJibGc0NEVuTWdCYktwOEdBU2JDaG42UlVrX2xrNWF5X1BUSGw0UEkwQVRiSzhjZUdYelJHRUMzVFhGMklMeHo1UmRVRm5VNHZBSDJGbEZYUWdhWFJSRThhNnlqY0JVcUJTVUJpc1VsMUV2X2VYOFRWbEFCOFlwMnhPSlRMZUEySno5WGVpRUtRMHBCVUtEUXY5N3NkZGVGNDhUZktuVkNYUHVHRmJFekdrWVJWcTlZ?oc=5,"Tue, 02 Feb 2021 08:00:00 GMT",The Economic Times,Tata Consumer acquisition,passed: named FMCG company + deal verb present (exclusion check bypassed - trusted acquirer identity),tier_1,1.0
Tata Consumer to acquire PepsiCo’s stake in NourishCo Beverages,Tata Consumer to acquire PepsiCo’s stake in NourishCo Beverages,https://news.google.com/rss/articles/CBMiwAFBVV95cUxPbGRtZ3NCWlBqMURIeUtINHFqT2ZJZk5wTjl4SU5MZ19iWkI2Ylc1clJjYWVLWmtwNk1aQXNUYkZxZVI1QWlsYmVuY2RFSlZpWGEtR1ZnZC1JLTZReDBvWHpObExadGpNblBVa2tBQWluNVJjNHZ6V2VZaEo4bnVISVFLNWx1Y3hfTThXalFrMTFzdThpYm42OTZkdkRORWc2VFNNanRMb0hJNGxzYTNJOFJIa0NGa2k2U0pIbk9jMUvSAcYBQVVfeXFMT3BGbkpsOUxLRWlaWjB4djBzQzJIdmp1ZXBNbEN4Zkd3NHF2dGhrektMZjJkaXFUWkVfeE1iQXNaSzJlekhvckRkZ292Nlh3ODhOd3JmenJsUEZPTVdOaVlOWnp2aWVtOFRTdHZiMUtSYjlKcldPRk9jRl9qNTFEV1pzYXFLTk5zZThJWUhYS2IxN1dJa0tiWVNVaDJTejNrQmZVdlhHT29jdjE2dENuME5CYlpmTnFINzZEaVhaMkRsRTl3a0JB?oc=5,"Mon, 18 May 2020 07:00:00 GMT",livemint.com,Tata Consumer acquisition,passed: named FMCG company + deal verb present (exclusion check bypassed - trusted acquirer identity),tier_1,1.0
"Tata Consumer Products not to acquire Bisleri, ceases talks","Tata Consumer Products not to acquire Bisleri, ceases talks",https://news.google.com/rss/articles/CBMiugFBVV95cUxPUUpLbVhGU2hWUW5MaU42aFlKV0l0ZDd3eHducDFBQmZNMXFEYWppU1BWWUlQOEtSTDY4UmVXenFRMGl0R2hkTG1NRzJ3N1FCT3NSOHRhTGhnbV9abVdYbTVMZEVoTnZYVmpfMFZPRlJfMFpxNzBadUVINkR2Sld6VlB1b2d0NkdLX3kyQ1J1YnVNMzJ3VlYxSnF0SEsyVXpkaGdhMlh0Zk1Qb1U2TVBad253OUZlQXhlVnfSAb8BQVVfeXFMTUpUSTRBZzFYTFF4RnA1WWlwQkZLWFpUWTRzRXRuM0U0WUROMG40Z3E2cXJQMHI0N19MTGY2UEhnbU16bndqWWtKUmptcHp5eG5OcnkwX2xWYlJsN2RIS3diS2haNzg3Z3dsXzNDVEJvWU5ueERNSWJXQlNrckxVX3ZTVlA4Ujk3Q05MZHFxV0Y5ckh6cDA2OG5vT21aYVgxZEdTbVdPZW9MZGFfQ3kwMGFuQ3hjQmJDZFV4a053Mlk?oc=5,"Fri, 17 Mar 2023 07:00:00 GMT",livemint.com,Tata Consumer acquisition,passed: named FMCG company + deal verb present (exclusion check bypassed - trusted acquirer identity),tier_1,1.0
"Emami completes IncNut acquisition, deepening bet on the personalised beauty boom","Emami completes IncNut acquisition, deepening bet on the personalised beauty boom",https://news.google.com/rss/articles/CBMi0AFBVV95cUxPYW1lMVQyY1R0M29qd2NDWklMWDVVN0RmZ0EzcG51N0trZnhVOVpPLWxLY3dNMWN5YW9FUGFieWNxZkZmQlp6WG4yZmJJZ2FEaTRWYzROLVVselc1VUxlNEh3alNCRVd0c1JvamhwNHVxb2JPc2lseWxxOFFKekNyUDhteUlhUXdBb3ZrTVRNb0Q3c3RwdE14d0hfNk8xMVI4QzZhWkJpTXBEMG9TOHE2OXJHeUVYTVVyQ01Hb2tXSndYdUk3MnpLLUdLak1EekRs0gHWAUFVX3lxTFAtOTNjQ0pxNWliOEFJbXNRM2RIQzd1aUY3M1ViWFdiS3RmNjJ6RlNkUm5scGdYZnBhNFJ6Y3NJdTQ4U0k3YjI2SE5qQzFGY05GWjdXVEpFMzdSdURBN0Fjcmh5MExZN1ZLQkZJM2ctcVNqaVhWaVl5NjBwbFliSmoydWZvdmlmZzVTZVdQNlh5SXhBcVhrbjRkNHlhdTdFanJYcjQ0eDZYQ2JHcU15N0NZMktQTHY3Zi02UFhuUEM0WDVvMHg2VGtIcVZiTGNhUGJqZGNQa1E?oc=5,"Tue, 02 Jun 2026 07:00:00 GMT",Storyboard18,FMCG acquisition India,passed: named FMCG company + deal verb present (exclusion check bypassed - trusted acquirer identity),tier_2,0.7
Marico CEO on why the FMCG giant won’t bet blind—on D2C buyouts or quick commerce hype,Marico CEO on why the FMCG giant won’t bet blind—on D2C buyouts or quick commerce hype,https://news.google.com/rss/articles/CBMinwFBVV95cUxNV2tidDFfOFA0T1Zha0NfTEk2Ry03eTdSMHI4V1lYZVk2YTlpLUhFaHRVd2Q0M1k3dm5ybTNlUG9RajVlV0RIXy1mNk5NXzNoSGxkeFVzOF9XVUxva1F4ZHB0RTZIWUZLVkFPOGtWTGpER2lfT3EtYlRLVXBUSWhBU3UxYS0yQWtaUTVEOHVyY3JVSEpmN2RZZThoXzg0VXc?oc=5,"Wed, 04 Jun 2025 07:00:00 GMT",YourStory.com,FMCG acquisition India,passed: named FMCG company + deal verb present (exclusion check bypassed - trusted acquirer identity),tier_2,0.7
Marico Acquires 60% Stake in Cosmix Wellness Valued at ₹375 Crore to Expand Plant-Based Nutrition and Wellness,Marico Acquires 60% Stake in Cosmix Wellness Valued at ₹375 Crore to Expand Plant-Based Nutrition and Wellness,https://news.google.com/rss/articles/CBMi2wFBVV95cUxNMDNTT0RsS01vLURHckZUOXNzVUJYM053TVRqSjdVUWlZRTg4MEhFMDlPd1lfdXQ0TkpDUDdPa0E0dWxDZU83TndOd0RjZWhOdl8wNkkwSDZxaGxlb0ZOWDZxeDJhYlRxTDliNXgxcWZ3TDdnWnlRMkxlOWNVb0hER2Q0eV83T1BoS21obmNGZGdlMWgtejUwVHhXNDhXa05FVjlERTRKUTdFSTVQWXJuNFZWOWRmZ21xY2QxdXpzc2w4WjFwWkpCNWMzVGZyUWM5ZEZ4TFNoMWdqMkXSAeABQVVfeXFMTV9hdEw2czRnUlAxQ18xVUtRaEJXbW13YU15TnZJQXNNYWdPNmFONDNoTkRPN1BuT3hOcEQ5LXRmdV9uWFRReWhfUVFfUjFWWkRTSWxicy1NNVBTNmxnLWQzOWxiLS1zb0U3ZWlYZi1Da3BXeVpYeGh6emswQ1NwVElHSGFsbWFiNzNDZnlBbW5SUzNnb2tkbUQ4UzRTM1JOamV5Qnk1ZDB1bWVWa2ljeklVRll4X3JSd1dDZko5c0hQdzg3QTB1eWlkNl9mNi16czlpZFFHdFNiQ2Z1UnU2bF8?oc=5,"Wed, 04 Feb 2026 08:00:00 GMT",CNBC TV18,Marico acquisition investment,passed: named FMCG company + deal verb present (exclusion check bypassed - trusted acquirer identity),tier_2,0.7
HUL sells full stake in Wellbeing Nutrition for ₹307 crore; moves to fully own OZiva,HUL sells full stake in Wellbeing Nutrition for ₹307 crore; moves to fully own OZiva,https://news.google.com/rss/articles/CBMi2AFBVV95cUxNTUFWWXExOXZ3TDJUNG12enZoZ3lrSWM0U0FpV0ZYNGtHcFZvQU5zdzNoN244SUdEbFg0LXFvcmJFUXJlUFp5UmJreGFkM3J1LWJPWk9xUGRxOXZ5YnZlaWJKYjR2clFGRVlLdkZfTmRqNi16eXIxaWFacVpWQUU0cFFBN1ZvUWowek5Jc0w2THRILUtXcHJMd0NWLTNhazFfY1VRc1lhb0RZTkRjcDQ1Ql9PT2hxUUVzRFA4ajZ2cmczRk03bzlLQUR4bDdFM3NuNjFxV1k5SFrSAd4BQVVfeXFMUHA0ZjkyUi1hT3Z2enF6VzZuX0hGODFuVmdTS3FVSzQ4Nk1Uc2NvRmliSHA2OFZuTXhoSkYxcmx6aGN3Y1A1R1lUZkJMalRRV2Z0QkVpMjUtZ1Y5YlFWTl8yU09pU25Ta2ZKTFVnVEdkTllLbG80NHFvTWRMeVRTWFY2aHk4Qnd3bHI1SjBKcFdaSkRRUG90VjZHS2h3TWM1dXFJYzVJaFlHS1MwSGtTcHlKTUZpaGltWXRaTDFYUG1wVE4zSG9xNEJKQjcwX3lWOGEtYzB5QXlMQy1xRTVB?oc=5,"Wed, 04 Mar 2026 08:00:00 GMT",CNBC TV18,FMCG merger stake investment,passed: named FMCG company + deal verb present (exclusion check bypassed - trusted acquirer identity),tier_2,0.7
"Haldiram's Rs 56,000 crore stake sale has a 'SpaceX’ angle to it","Haldiram's Rs 56,000 crore stake sale has a 'SpaceX’ angle to it",https://news.google.com/rss/articles/CBMi2wFBVV95cUxQWE0yUTM5V2xIdzRaSERzZlhWc0pobE5BNnVTSmF2ang2LUMzSWt6cGEzVFNCZUl4QTNBZGp1SV82dTlac09hbzFqd1JpeWpWd2dVam1uWFpWX3ROaGVHc1o1b1lDWE0tNk9GU2I4cjNwMXRQTnRSNU10bVFfdk9EZjZIMWV3OUgwNmpZaklWZ19LTXh1TkdFV1l3WXNzZzdxVDAxSTh3RTdEdlZVUl9pYU5oMk4zeURDRXRuMk1za1RsM2FpRVM5QU5NSVRSX2dRR0l3R0FkbDlVOVHSAeABQVVfeXFMTjgyOTF2OTdfb3dXQVhpa3R6Z0oxWXRDellBMldRbFo2dldzWjBkMjd6RU12cTJtdGRMR3NPcjVxaDFUUzN3eUFnMjFRVldYWnRxTkgtMm5CQkVlVUctbGZpNjZ3MTVWNEh6RUpYZXhOMDFON3poUklvNFhLRC14dXpvLUtMWkV5WDlUTDVETHRiVnBpMXotOHdUbmNuSDdLeHdqVW9qc0ZoQ3VjUm9uTVA1OWZjQjVLdWtJRHZ5Nks2ZFFLaE1kb2hGWGZ0Q3VIWFJDVlg0N2s2SWR3VXVhV3k?oc=5,"Wed, 02 Apr 2025 07:00:00 GMT",The Times of India,FMCG merger stake investment,passed: named FMCG company + deal verb present (exclusion check bypassed - trusted acquirer identity),tier_2,0.7
ITC signs agreement to acquire frozen food player Prasuma,ITC signs agreement to acquire frozen food player Prasuma,https://news.google.com/rss/articles/CBMi2wFBVV95cUxNU0hvazFtYnNGeVpCS0lCbjhCTV9wMmc5d1NUNV9SRUdqSDZQTGhneWVDY2xSbUhLWVZjU0szaldtQmlhRlVJV3prWE5Hem01aGFJWlZlbXZyb1pYU21wN3gwazhTcWNPaTZYWDU2Z0NTNkhldFU3dHRlSTAtWktoblNNSmVEbzFVUUJaMWF4Yl93WTk5S1B6S3JGMlcyb1drVDZFNXF2c2R5Ulo0RW9aMHRzUzBrTVlzWUxmMmVnWUwweFpZbG8xbDZzXzBkWi1RaE0xamNUTHZna3PSAeABQVVfeXFMTWtrRmwwdEl3T2pQQVgzSnlOVkhXdVBPZzhwaFg1V2E1TlAwLXNjb0Vfc3BWR0k5WDBMOVpQWE9CN2s5d3hWODRyWDdSc3ZtOVRHcG9hUUtWZEdLRnlzT3dZZndGSXhFWjJ4V1BiSkdsOGNHdlpRU01WSVdwemx1VWY4d2JfRG1WRjFMb2hVU3l5OXJjQ2k5Q2hRc1p2ZTkzWFJHVVAzWTdKVUVNeTYtQm5aMTNuR09TRXFuWG1MbEFqTTFLd0EwY3d0SVEyTlBTLUd5UlY2Rm9Nd2I0ZkU4Nk8?oc=5,"Fri, 07 Feb 2025 08:00:00 GMT",The Times of India,FMCG merger stake investment,passed: named FMCG company + deal verb present (exclusion check bypassed - trusted acquirer identity),tier_2,0.7
"Marico makes 'bearded deal' with men's grooming startup Beardo, acquires 45pc stake","Marico makes 'bearded deal' with men's grooming startup Beardo, acquires 45pc stake",https://news.google.com/rss/articles/CBMicEFVX3lxTE1vU1lxUTlScmkwN3E3ZnF0UjVwUmFCQi1RUXVmZ0tTY2VXb0FYc0hRZW9sR0RvMkswd3pUeWdaS19zelF0emhqNTh1TG9RN2F0TkdGdHg0dzA2TlRVYUlWeTRKVUlZdjFGWG5BY1hOQTY?oc=5,"Sat, 18 Mar 2017 07:00:00 GMT",YourStory.com,Marico acquisition investment,passed: named FMCG company + deal verb present (exclusion check bypassed - trusted acquirer identity),tier_2,0.7
HUL acquires remaining 49% stake in OZiva for Rs 824 crore; divests 19.8% in Nutritionalab,HUL acquires remaining 49% stake in OZiva for Rs 824 crore; divests 19.8% in Nutritionalab,https://news.google.com/rss/articles/CBMi2gFBVV95cUxQR00xZ2dQSnJBRjBvNHVxTGh1STFFSklyZ3duMEpzNENNUjY4UUpwZXpZb3ZzVlpsUjFGYld0SkVwUXVqUDQ0ckdXY1M1OGdBLV92OVYxemNzMHR2VGZFX2xBMjJ5UWkzMXJvNFcyMDJ3OEdzekstNVZlUktnY2xQWWM1Vkdia2ltXy14UFFEbl9tWDZ5a2xXWlg5Qy04eEQ1cVlZMFdPS0NnS2dzMkRVdXh2bE5tLUJ0elpTdHhmRV9QVWltSF9kTmdYMHZBdko3MTlLc3pnVFFod9IB3wFBVV95cUxQRDR1NDJZTnEyeUJyVVllcVlhczFrb2JEUGVjemNHb2pZcTEzYVVZdzduSDhGdVBsREFSdlJGeHU1cW9iTE1ERHp1eHNOcGs5NHJmekxsN1J4YlQ0dlN0eEc5eGd3YTlFdEltNGVtSS1VTXg0TWRyUTZEazIwN01RalhZTHQ5Q1gtYmtSeHVBSGd5dFFBSFFDTnljcUhETjRteFB5dFhJZVI0WXVrbEk0b0FXcnBHNlU4d2tFUktGN0xGVDNaY25kS1V6RkRxMlZ1WTJDd25TNG5ZUmFuUG00?oc=5,"Thu, 12 Feb 2026 08:00:00 GMT",Storyboard18,Hindustan Unilever acquisition,passed: named FMCG company + deal verb present (exclusion check bypassed - trusted acquirer identity),tier_2,0.7
"Unilever set to acquire US supplements brand Grüns, expands wellbeing portfolio","Unilever set to acquire US supplements brand Grüns, expands wellbeing portfolio",https://news.google.com/rss/articles/CBMiuwFBVV95cUxPZ0dfMDcxV2JWcEVjdUVKSEp1U0ZET1cxNFNCbnRiblktblY2aEpyeU5OT3dLTEJWdlJZaFh0eHZBdmVxcWt5TXpGSzF0b1NSUDRCd191ZHpHcHJsdW1fYTB4NTFSSWdCX3RkSDhfUVhEQ1BoQmhheDF1VTZYRGJid2szVHZkR1RZWFVIeHFCbVI3SUhMVjg0TzVKRTRfaHV1QUQwM29oVnBPRU1RSmRjY3lYUUVLZ0VJeWpz0gHAAUFVX3lxTFBsVGRoT3ctU1dqYXpER3BvX2pYY1hQY3VpNDNCc3VUaVd5UG9ELVRRQ09LNFloS19hNlhVLWxmR3BrcjdZSUU4dzBrLVpyYUdIT1UwTVRpdjBYcUo5REJfSUFOb29ESXg2b1BaMUtQZUhkWlU5dl8tTnltY3pzSk9JQmhybzVjdFdPYjkzenplZVdVZ25iZ1o5WUJLUlpsWFVZeURJUVFWZF9SUldsN2gySF94TkIzSlZvUW5uOERrQQ?oc=5,"Fri, 10 Apr 2026 07:00:00 GMT",Storyboard18,Hindustan Unilever acquisition,passed: named FMCG company + deal verb present (exclusion check bypassed - trusted acquirer identity),tier_2,0.7
L’Oréal acquires Indian personal care brand Innovist,L’Oréal acquires Indian personal care brand Innovist,https://news.google.com/rss/articles/CBMirwFBVV95cUxNN3QtSXpGZ1NNZzU0RmxYREhGYU56SHNXX0cxNnF4VUJ6YWI2YVRKMEN5RW5KQTYzc2hTdWZoVFBPenJGS21oTXpKdHI0X0Rkb041ZE5pclA0bEZ0SXBQY2p5bUlNVUI0VlR1cG5wRk55Qk1nbjF6YnVEUFE4WUtXd3lVNWNOdjhwbW16WFN5SEJmZU5RZHBnVFBtWTlJREtSbloybmU3aGpQSFdQbWhR0gG8AUFVX3lxTFBLeGI3ZFphcnRISy05RHZNOXRXVnVoMWphamNHYk01Y0FXNkdnTDZKeUFMbkFmZHRCM3ZVM1lOZTlzQ25jMzg5aExSdGRleGQ1RzkxSFl2U3c2MWNoQXBrelNRV1RvU2RiUVBDbEJOZkUyTDBaV2pHb1FYMV9SQUhjd0FjSmRqdm13dmhVTU82Tm1vbUpCQ1lEbVoyUlNqUjIxeWdsbFRFcElBTlJSbmFWcjRtNlRic3RiR19i?oc=5,"Thu, 18 Jun 2026 07:00:00 GMT",The New Indian Express,Hindustan Unilever acquisition,"passed: FMCG entity + deal verb present, no exclusion hints",tier_2,0.7
Marico set to acquire 60% stake in D2C nutrition startup Cosmix,Marico set to acquire 60% stake in D2C nutrition startup Cosmix,https://news.google.com/rss/articles/CBMilgFBVV95cUxPa2hBaTA5Qm1weDZEZzZkcHZxSVNZVG0tN1oteS16V3NydS1DXy1BSUFDX2oxQmFCMG1kMndJdXV5Qk52eEhDTnFMdXUzTFpjRjlwZjkyNTAtNU1zLTBnZjBzVzZnRXRKQTZ2UnZ5em1kc3JVRm1vQUwxLXRDMlloblZISkJtVFlrcWhJdXZRUVNaMHZwSEHSAZYBQVVfeXFMT2toQWkwOUJtcHg2RGc2ZHB2cUlTWVRtLTdaLXkteldzcnUtQ18tQUlBQ19qMUJhQjBtZDJ3SXV1eUJOdnhIQ05xTHV1M0xaY0Y5cGY5MjUwLTVNcy0wZ2Ywc1c2Z0V0SkE2dlJ2eXptZHNyVUZtb0FMMS10QzJZaG5WSEpCbVRZa3FoSXV2UVFTWjB2cEhB?oc=5,"Wed, 04 Feb 2026 08:00:00 GMT",Entrackr,Hindustan Unilever acquisition,passed: named FMCG company + deal verb present (exclusion check bypassed - trusted acquirer identity),tier_2,0.7
HUL Completes Acquisition Of 90.5% Stake In Minimalist,HUL Completes Acquisition Of 90.5% Stake In Minimalist,https://news.google.com/rss/articles/CBMigwFBVV95cUxNdExNLWNUa1BxN2R2dVBHYkhUMUkyR0VPUzNsbjJhQ3ZveER6a2FEci1CaV8tYW01dUJudmxidk41RFFkTGpJZ3ZzMFo4akNvdVZoeEItaS1VNVJDUmZlbEpWRjRxSDhKTVVNMzVQTkxsSmRBZm9SUGNBWDJzUlozR1d5WQ?oc=5,"Tue, 22 Apr 2025 07:00:00 GMT",Inc42,Hindustan Unilever acquisition,passed: named FMCG company + deal verb present (exclusion check bypassed - trusted acquirer identity),tier_2,0.7
"After Unilever, Nestlé reassesses exposure to the ice-cream category; could reduce Froneri stake","After Unilever, Nestlé reassesses exposure to the ice-cream category; could reduce Froneri stake",https://news.google.com/rss/articles/CBMi4wFBVV95cUxPWVhrUkVBdVZBWVdjUXdNbml5NVZBV2hsbGVpSlNCWjFRa21aaWNSeEpQRGw0U1I4Q0VkWkUxYUl1T2xGaWo3UV9WU0drSzZ3dng4b3BJTG9qNFRhRzhNNXJBS05UVWswRWZnRFNsOG9kLUc4bnItalNLM3BHTEtac0h0N2dvLWZ6dlpPV042TWZVWEtSanFzZEJ4VmJ0d09vRWs5ZkVOa0M5WTlORlM1bEhkWUV3alBFcjFvNVloNjM0cXdLbW4wblVrX3pBY2xkLVJaeEh3a3UxSlAxakYtSlNvZ9IB6AFBVV95cUxNYjQxR0duLU8xaWhQOUppTFpvWHhCNm5GSVh0ZzVGQVpaWVZ6eFY4eUNFOWNpZFJ3dGFGMTI5MUFOZmc2cklLZkdYMld5dmRGdG1ncUo4TmkyTS01TWU1Mi1NYlpBdjUyVGw5dms2cTJkTGhuN1B0ZXVDZHpQN3EwSDdWcjgya2RQYjl2eXdqNmpCR19NUUlQcV9kV2hJeDdJRjVOeGNJRXZpeE9UQWcxYVV0YlJKSjE1LVVib0llazdDaXRMaTlrQ3hXVklHZjdJbHJXWU1OVmYwSURCUUc4Z3VlZ3oxcGcx?oc=5,"Thu, 19 Feb 2026 08:00:00 GMT",Storyboard18,Nestle India investment stake,passed: named FMCG company + deal verb present (exclusion check bypassed - trusted acquirer identity),tier_2,0.7
"Nestle S.A. invests in India’s Drools Pet Food, acquires minority stake","Nestle S.A. invests in India’s Drools Pet Food, acquires minority stake",https://news.google.com/rss/articles/CBMizwFBVV95cUxNazl4MVNfQTcwdzIxZnRwbWNKcXZoM0ZYa0FPam1EQmxkZGxxNk41dEJSNmkxM04tZi16X1ZKeHF3ZEJOT0oxWGpTY285SThTbksyaDI0N0NJN3JhbFVtdE14djhvaTU0bGxnbWFrRzhjSFNMYndvSDdLNm9Sd1dSNUJaZHlGemVIRVVXek82cVVwa08zSzFtLUJqVGxZLTU1bmttVGtjMkFnZzRqOXRVZ0F5cGVfLTFsOHBBX2hGUGs0Nk1wem1USFo1Y0h2MzjSAdYBQVVfeXFMUEN0TjV2QWhoS01QWVNBNDB1VzN4RjVac095ei03eGtBVWJTV1Y5Y3RCXzFSMnVETUNGa0l2NmpTRkRYYUhwN2FuMjc1QVNhLU84Z0pSakZ0UG42Y3NsSXphUzhGNEhPaUdkZmhvS09TOHliRzh1OFVPSS1yOUFLXzgzakVsZ3JidGg2NWVoN2NEakNMcE40R1FjM3lEem96UjVOVWNPcmxYZF9TbGJmMHpKLVFyemRkRml5NG8yVzE5c3FFNDJJMzZSbTBpNHhkV1lpU0lMdw?oc=5,"Mon, 26 May 2025 07:00:00 GMT",BusinessLine,Nestle India investment stake,passed: named FMCG company + deal verb present (exclusion check bypassed - trusted acquirer identity),tier_2,0.7
Drools turns unicorn after Nestle picks up minority stake,Drools turns unicorn after Nestle picks up minority stake,https://news.google.com/rss/articles/CBMi2wFBVV95cUxOSmhydHRtaTh4SjdJZEJsdjd5bUNFV0Z6SXBPVHJDQ0FkbUdhTHZOWE4xLXdWbzdjMGhfbElKdlJvZjQ0SUNPdTFOSDNuVHVBb01MM2xud1pZcEJGWHotUXBTR1ZjaDJELU02c2Q5Z01Ld2h0Z1JOb0RiZFJNYXk5cmJwZGNWRHNJUVo1RlpETndEMkNpQk9oNnBBYjNTTi1DU09aUjh4VFc2bHVRRjFWX2dJdmpuWGlXWllXNGJYX2tfQlFtRk5HdEJlSkFtVTRJaWhGMUtkV01wUmfSAeABQVVfeXFMTm96cE53ZmNIUmQ4QXl1RDFyTkpWcS1hM043TmZSZS1IakVLemJqRGdlZ0wwVHU2cEE0U281MDVnWGVJbXJWWldEMU5RbTdYZEVJei01SEtzUDkwMF96cTNaQWpKUUtZYTBnUTR2QXAwYTlYVUxTTWxiU0JBQzRDSGpSazV2RjZXTEN4eEFwemNWOWRHZ2kxLVpSN1pPeHRZcDNaaHJMZkFOQ0NfTVgzdm5pZEp2akYzUXhoTWtPVFJVTFZaVFVQeXBwYUZyXzgzazYwdlJjeVFhWTk4RHVxMkw?oc=5,"Mon, 26 May 2025 07:00:00 GMT",The Times of India,Nestle India investment stake,passed: named FMCG company + deal verb present (exclusion check bypassed - trusted acquirer identity),tier_2,0.7
Dr Reddy's invests Rs 734 crore in JV with Nestle India,Dr Reddy's invests Rs 734 crore in JV with Nestle India,https://news.google.com/rss/articles/CBMi1wFBVV95cUxPOUpHVU9iM0VIelhNdXNGcGo5VVUwS0IxTTd5QlBaeFlUSkp6a1hyRjdwWGQzUnU5V0FIZ2dZZkhHUnAxWWRVMzBtQTA0dWFBb0ZHZjRDZnZpUGxqTnBnUWJPblRiWWNkaDhQaWlDbkVRQ0dhc2tkZVMwLV9keWg5LVJwbzRocE1PSzZFTlk0d1Y2N2FxdUtQMmR3emFhRDROT2IyY1VhcDVfekNESEU1NG9jSDRDeXBMM2lnOEFaNHFtLVFKOVYyM1huX2txZUxIQlFNRmY5d9IB3AFBVV95cUxNNTJoWnFjV0NGNXBMeWU0cVBFT0laNW8tMV9XZ2tYUjZFNEJVMEtVSGRMVnpzUjlDWklsb0FmczNaMDI2QmswVzNVdklRNC1NU0p5OGV0X1lhS09sM1VTWkRMblBqV0w4NDF5LXVrRHIydUM0RllWX2hwejhpVjlMSjhObWNSQTBSMHNSREpsZmhDUnpKc2JEWXlyYnNRQ0RmclI2SmI4cTV0VFlrMUNFeUxNQ0lPaFJrMnNsZXk5SXF3X2hKY0Q4OVppMDAyTVFmaXZ4bXVfNjdCbGZw?oc=5,"Fri, 02 Aug 2024 07:00:00 GMT",The Times of India,Nestle India investment stake,passed: named FMCG company + deal verb present (exclusion check bypassed - trusted acquirer identity),tier_2,0.7
"Singapore state-run Temasek acquires 10% stake in Haldiram’s for `8,000 cr","Singapore state-run Temasek acquires 10% stake in Haldiram’s for `8,000 cr",https://news.google.com/rss/articles/CBMiwgFBVV95cUxOemhDeEpWUjg1SFJpc2NLOURYRzJXcU1iWGJ5am9xQjBoMGJUZ1VDQTBmOG81R24xbERWNWFNWWtSVnNfZ3dMU1FpS1Z4UF9Xa1hHaGdaSG9yY0pQem9DWE41aDN2Nl9kVGM0dkg5RTcwYnI1N1poNEZuakdEam5peTdaRFJtQ2VOSjNPNDRaalN1b1BCU2hYdmdReWxGSV9naklXRS1BeWZ1NmdfLUg1V3pMU3lkZ3NsVVZ6dWVXZ2x6QdIBzwFBVV95cUxPYTNVdFhVUmxXQ0hKNXp1Z2gwVjB0RjNBWnhJVlpwZERWckFrbGlNSGxNMUZFR0lCbjM2N2VyeWdNOTBuNk05TVFieVpraDdjNGZzcUpkcnhhY1h6QkFQVGwxX3dXaTFYclRjcE9oa1hGWHhkcVBIZTVhLWhCZHFjNFBKRVNwV19SLWVJU0gxNmNPNFpMaTQ3c0FKV244Tk8zYmFCbXlDTjV5TkViM0dNNnQ4YURjcVdNNWZ5VzBiRld1eUdpV0lVTUFRTXBhbVk?oc=5,"Wed, 12 Mar 2025 07:00:00 GMT",The New Indian Express,Nestle India investment stake,passed: named FMCG company + deal verb present (exclusion check bypassed - trusted acquirer identity),tier_2,0.7
Dabur announces acquisition of majority stake in Badshah Masala for Rs 587 crore,Dabur announces acquisition of majority stake in Badshah Masala for Rs 587 crore,https://news.google.com/rss/articles/CBMi2AFBVV95cUxPYVFqR3JEZ1NHOE4yZEUyVnRzMXMxMU5DeWhDSnpNVm5XZnhkQnQ3MEdVN0phWXJDbGpYZTFHM1lkeTZVcnBzNmlhRG9HaWVtclFXdHYzVVAtN1VsaDJwVkNUZjA4V2FZcGpLbVgxTW5GZkcxYzRNRTVnNG9tb1l2NWw3dkktR01QWnF1bzE0LWV5NzdsdXYxX0lTSEkyczBfMUxJSnZSWFJlQzU4VHE2NWUzYUY3d1lQdVM4ZVpiZ253Ykp6YXJBcXdjSHdDTVdJUE1raWVaa0PSAd4BQVVfeXFMTmpEYkJPMkU5ZWJjZXlwdUx6VDVaNW85SWlCWVpaNXZXZk1sWGRHSDgzNmNMMEdkaVUtQV81My12aHE1ejNOeUgyMnZKNmZrdzFkU2tnaEI2Szl5TGl0VDYxb2h2QWVrQnRlLWlPYmo2SXltVDZkdmVxWkhrWXZHTnFRaWZER2w0aERvQ0JXQnZacGVRaWlwRlBmWUdsTGJUZWdnTkxyV0RDaEJybm5QeUp5azBkNkF3Wk92YlJPaFNzQXptQUZQWWRaNDYxY2dCLVRfQXB0T1BlcGRuVjdR?oc=5,"Thu, 27 Oct 2022 07:00:00 GMT",CNBC TV18,Dabur acquisition stake,passed: named FMCG company + deal verb present (exclusion check bypassed - trusted acquirer identity),tier_2,0.7
Dabur acquires majority stake in Badshah Masala in Rs 588-cr deal,Dabur acquires majority stake in Badshah Masala in Rs 588-cr deal,https://news.google.com/rss/articles/CBMitwFBVV95cUxNOHNjbnVfS3BfcEJvVENTX3ctLTkwV2o2dlFPb3ZmeldyRkx1enpHLUhFbkxsNVlJOFdlQmNPSkFRUFBJQ21zQUlEVC1oNEpZeFZER095ZlZzOThMN2tnRjBSWnpsbzBLcVVRTktMam5XdmllTFpsUDYzZ2tVazhPcERPUVhoTDZkdkt1b2U5YnlQUFBTM3NIYkp3Q1RhS2ZITjN1ZTZZZE1BMnJzOWxzSnhRU3ZpWU0?oc=5,"Wed, 26 Oct 2022 07:00:00 GMT",ANI News,Dabur acquisition stake,passed: named FMCG company + deal verb present (exclusion check bypassed - trusted acquirer identity),tier_2,0.7
Dabur owners' acquisition of additional 5.27% stake in Religare gets CCI nod | Business News,Dabur owners' acquisition of additional 5.27% stake in Religare gets CCI nod | Business News,https://news.google.com/rss/articles/CBMi0AFBVV95cUxPTy1DZEF1YVFyQTdrcUhISkpKU3J3Y2c3VWRjbE1EUzV2a1FMMDJkcThRZ2lXaF9HaV9FaklFRm5xcGl4bU5rclZuaEluMXRndjJmd2VxN3g3UGZqZmNPTmdHdDBWZkI0YnhGek1zOGZMUnRNTmRSdGpUVVlqVzRrNjdUTC0zQlFnSnZ0Y0Vxb01NN2VSVWNJa0tLZFBDQjF3bWh1YkVKaXJLTHhLVEZ4T09Kd2ZWYmFHVEVZZzhJbmlHZTJ0VnBselI0ZjFjdWVI0gHWAUFVX3lxTE1qTVkySGtITlJFeDFDblQ2dGJIUkliMXZUSFRxSWp0VzFmVS02RFhNUDg1VnVBcXpsQWdVNzBZQm91OEw2LThuSGNGa1FxQ1ZPU1F6SkNxYTBxdTlKdXV0MGpGMWZVTGhHaG5CVTk1RmEzQXR3MW1TYzNwYTdHSGt0Qk4yVkZsbElEdmY3dzViNEJCa2ZsZnJoRVZkTUpzQks1OTk1MUhQbnpadE9RYWJaT2hlbXhaZzUtUjdKYmhwS1VLd1BzcW5reXZWbkk4VVRBQnFHV0E?oc=5,"Wed, 24 Jan 2024 08:00:00 GMT",Hindustan Times,Dabur acquisition stake,passed: named FMCG company + deal verb present (exclusion check bypassed - trusted acquirer identity),tier_2,0.7
Dabur India to buy majority stake in spice maker Badshah Masala,Dabur India to buy majority stake in spice maker Badshah Masala,https://news.google.com/rss/articles/CBMiwwFBVV95cUxNdklFMmxiLWpCVFFHLUZEVFF3alRZR3JWYWx3OGJKVDNsTHZHSWE4RFo0VURBR0dpOE9nRThkNlF0Z00yOEZVUXRublF5ZEduRW5nYzF1ZFB3dWxNZ1I5cGIzUXo0RFYxcVpQeWpEYmlRdVNJbDZHSHltQUoyUzVLeEN5WkZnZng0b0hPaDAzY0JRLU1tTm5jRi0yZ2ozQXhZTm5wUEJ2UWtKZDJzU3FYTXJKNDVDcFczNVVkZDVqWE5VNWPSAcoBQVVfeXFMTnBWVGZBZWgtVmphc25PMnRlaWhiT2xnNWtTZXM4cXNRVzZIenpQTGNFNlhoYUc4N1pIaVdPWjVpNGxKSUwxQWNHaW9vbFZoMGt0WXBzcXdkUk5wUjNVc0Z5S0JlR3JtSW15amtCdUN6Y0Y1ZEhkbzhtZXdDX0o1SFk4RDZzTFhOS2JxTVlTTjhmVkNzYWR5M2JJTjV4el9Db1ZadGgtT1R6VnkySFVaR1hKUC1HWjQwdGx4VTU4STZZLUVjUW55RXIyUQ?oc=5,"Wed, 26 Oct 2022 07:00:00 GMT",The Indian Express,Dabur acquisition stake,passed: named FMCG company + deal verb present (exclusion check bypassed - trusted acquirer identity),tier_2,0.7
Dabur’s got its Badshah on-board: Acquires majority stake in the prominent masala brand,Dabur’s got its Badshah on-board: Acquires majority stake in the prominent masala brand,https://news.google.com/rss/articles/CBMi6wFBVV95cUxPdGJiUG9oOFU5bEdGVmF5dTNPX0lBNHVFTUVISUdzeEk5bUpoMjBpU2l2anJ1SEtJTVBaVGs3QkdWRDdUTTRZWUtLZG44dUVoU202Y2VHOWlQMUQ1dDBCbmMxcW9wU2hGcTR4UDdWYkJ0eW9JXzRTcDIwMC11U0djUFBMYzNQdk1Od01ZZTVrOEZSVG1YUW1MUVVfVmtYNlNCUUhEdElJakE0YjNsMGszWGhjakRreHVsVGxCakZLUF9ad0w3TlQ0b2p2UlkxejdXck9fYW1WV1N2TXpYRlAyZ0JZV29USjg0c1pV0gHwAUFVX3lxTE5mUTJiT3lxSk5SZ0dHVVpvbnlQaHdHYVNCdmZVdGZBUF9LLXZIcHY3ZjEwSXJRZnZvSjlfRWttNUtTbUxHOEQ5S1lQRVBkeTNVTlVaV2k0b1owRGVmcDNOSGZRblNGS2xxcWhKTGE3UGhIWmliT0ZHbEFHMkZrbmE4RTJ6YlpaR3AyMDBwaVJvVGNNRnRfX1ZmTzFvTEJWUkR2aEY4MlFvdFVWMWRKb3ZIRWtSdFNvQ21pZ1VYYjVPcHI5Tl95YmhfZ3lLVThWZHJwaFllRlVvT09RV01SelFOenpxbFpSUEV4YV82QVpVWg?oc=5,"Wed, 26 Oct 2022 07:00:00 GMT",Business Today,Dabur acquisition stake,passed: named FMCG company + deal verb present (exclusion check bypassed - trusted acquirer identity),tier_2,0.7
Marico acquires majority stake in Apcos Naturals that owns 'Just Herbs',Marico acquires majority stake in Apcos Naturals that owns 'Just Herbs',https://news.google.com/rss/articles/CBMijwFBVV95cUxPeXRDdENnWmlNdXRkUFpyLUplX3JfdnZPRDNNZjM4V2tpNDBvMXhKRXN1QVl3bURMVU1NVTdWNkxMTzNDellTR181WFRGMXB5UGl3bjBGdHo1cnY0OHNkNXV4dGw1QTNESzdWbmE1cmI0UUk4TmRILUI3dm5OUW1yT2VuV1RyV29mZ1VHNmhsMA?oc=5,"Thu, 15 Jul 2021 07:00:00 GMT",YourStory.com,Marico acquisition investment,passed: named FMCG company + deal verb present (exclusion check bypassed - trusted acquirer identity),tier_2,0.7
"What Mamaearth IPO papers tell investors about ITC, HUL, Marico & other traditional FMCG players","What Mamaearth IPO papers tell investors about ITC, HUL, Marico & other traditional FMCG players",https://news.google.com/rss/articles/CBMi9AFBVV95cUxPckI3NGt4YXFPNkZzVkxRLWswcUVwUmQxVW9YcndmOTJINk1FUFcwV0E4enYySHJ4em1nNm1GSEN1bUxFRm9NX1A4MVJqZ0REaGpFWVM4Z1Zoekwwdkl1cEFzajZYbnZJODFnV2p5dmlYWVc1Sjhna090c2V4NFpXQjJ6eHlIdlBfdXJ0aTlDdkhBbXE4ajYwOWdkOXV2dFlfZFpHc0VGU3VMUVlvQXl0Zm5SVUhROUhmU1V5Qk0wbFloeDJTWWs5eGZ6cjRfM2JLSFdSZjBjY2RveGxWOENNaVEyb2wySUt6UGY3TGE5VHhmUHdI0gH6AUFVX3lxTE9rQ3NCVXVvdUotN1JyYVJaV1NYOXZPMUd3cWUwSnRBdWxLdWUyU2NKV1J1cXJvdURST2NQajlJZzZybGtCSi11a1pncDk4eFZNOVVPR0ZWZlFpS3BrdC1GTWJaeGdTQkNKaFBqZHBBZUxzNHJ3ZV9mOEhTMnVtRHhneF8wZ0k5THJLNFBrZlJhWW9vaTVtc2NIWGFhaFU4Z1VPS1dOeDlwNUlaTW15OGFYQ2pWeFFEbHRJWjJ5cEF5bDhJQ2NER3g0c1ZoUEF4eFJPSEVmVUdGNjFvQ3BKNFFGTnNOaGFCcFB0RG5VdkxkLTFJLWpfZUpva2c?oc=5,"Mon, 16 Jan 2023 08:00:00 GMT",Business Today,Marico acquisition investment,passed: named FMCG company + deal verb present (exclusion check bypassed - trusted acquirer identity),tier_2,0.7
Marico acquires 45% stake in Beardo’s Zed,Marico acquires 45% stake in Beardo’s Zed,https://news.google.com/rss/articles/CBMiwgFBVV95cUxQd2g5MDZRaXNQeGtaMVZ6WDJQOHVGQzRSU2JXUVVjbDE5Vl9xeFVBNVpzZHdjNGJhV1V1Q0xSTXJ2LVA3WVo1N05NQk1aZ3ZqWk5VcDVyR2l6Sm1zdlFsRE4tZC1xWm1DVVRYOFMtZjRiVUdDNzNWS0RNRG14NGtiMXNmUjZvTHRyTTJGd1diVW0yZTZlN05wM1IzUzV0b1dpNW01d3g5Zk4xZ004TzNOd2JwWkg2c3RXRGVjaGw1X1hmQdIBxwFBVV95cUxPRk9VN28zUHh0YnI0T0RKVTRPVjBzbVNobzE2UXNxVTRXNUFZWG5GeUZjbVl4UUsxWkM3Vml5dXBpUXZDb3NISmR3dDNaYllzcEZEbFVlNHRSZUwtTlNJMTNKQ0JGNkkzTXNkSERoVUpSMDdkMThRNGc3NW1FTHFQLWg3UkNJYzJvbnRyWjA4Wms1NlNwR1BvUWd6Nmh0Szl6a0ZySHBQTUZOX3hQTS16czNQbFpWVEh6dlVrVFFzSFZwSU9XLW5r?oc=5,"Sat, 18 Mar 2017 07:00:00 GMT",The Times of India,Marico acquisition investment,passed: named FMCG company + deal verb present (exclusion check bypassed - trusted acquirer identity),tier_2,0.7
ITC to acquire 100 per cent stake in health food brand Yoga Bar,ITC to acquire 100 per cent stake in health food brand Yoga Bar,https://news.google.com/rss/articles/CBMivgFBVV95cUxOa1djSDlabVdNb3NDR0h4Y09rOXJ4cWZ5R0xvMm5vSmQtOVFIU0dkeFlBV1liOWxtamt6UEZBM3QtV3N4S1pjNmQ0VU94bDNQYWR6LURoNHVxOTJZamtMX3BtN1h3NEFwdTR6ZWxHcHdnRDBlLUZYbXlJMEptWjB2bVR4RjJkUXFQXzhwUkMyaWNoU0Q0MW1tSW1xWFNDeU0yWGZpWldlMlVtbURKaVh3TlZBY0Q0dXh6VllmQld30gHLAUFVX3lxTE5XOVdVNm5vSjdlLVl4N3ByekJwaG1UOFBkOVdkTHhjLWp3c0RKdDJDX0U1ZDZmVGZZTlNLcTYyOEV1WnJmQVBBMTBFS2E1LTM3STNvT3VtY0JHV1ZTc2JEclZOWFRvZ3Zub1pHakxhYURuX1JVTDhNM2ZMZEt1dW1vRXdHM3ZUdDdEaW4tZHhtVTZ5aEpCZVBEcFM2cTY4bENvZHJGVE1mdmNLTWdISXNIRlpxQ1RCM2lGS2RReE80RmtVR25VQVU3UG4w?oc=5,"Wed, 18 Jan 2023 08:00:00 GMT",The New Indian Express,ITC FMCG stake acquisition,passed: named FMCG company + deal verb present (exclusion check bypassed - trusted acquirer identity),tier_2,0.7
